ASIN,name,rating,review_count,price,product_type
B08KTV2F47,"Evoo 14.1” Ultra Slim Notebook - Elite Series, FHD Display, AMD Ryzen 5 3500U Processor with Radeon Vega 8 Graphics, 8GB RAM, 256GB SSD, HD Webcam, Windows 10 Home, Silver, EVC141-12SL",4.7,21,579.99,processor
B077BK5KVR,"Supermicro MBD-X11SRA-F-O ATX - Intel Xeon Processor Skylake-W, Intel Xeon Processor w Family - Intel C42",3.9,2,339.99,processor
B07RQPZ4H2,"HP Stream 11-Inch Laptop, Intel X5-E8000 Processor, 4 GB RAM, 32 GB eMMC, Windows 10 Home in S Mode with Office 365 Personal and 1 TB Onedrive Storage for One Year (11-ak1020nr, Diamond White)",4.2,554,305.99,processor
B07VDB92RK,"SAMSUNG SM-T290NZKAXAR, Galaxy Tab A 8.0"" 32 GB Wifi Android 9.0 Pie Tablet Black 2019",4.6,10509,119.99,processor
B07QCCRCRP,"Lenovo ThinkPad T590 15.6"" FHD (1920x1080) IPS 250nits Anti-Glare Display - Intel Core i7-8565U Processor, 16GB RAM, 1TB PCIe-NVMe SSD, Windows 10 Pro 64-bit",4.8,9,1310.99,processor
B003DWYUM6,"Lenovo ThinkPad X201 3626F2U 12.1-Inch Notebook (2.5 GHz Intel Core i5-540m Processor, 4GB DDR3, 320GB HDD, Windows 7 Professional) Black",3.7,36,1533.57,processor
B08PYYRS5Q,"HAOVM 10inch Android Tablet, MediaPad P20 Tablets Cortex-A55 Processor, 3GB RAM, 64GB ROM, Android OS, IPS HD Display, Bluetooth 5.0, 5G WiFi, GPS, Type-C Port",3.0,1,145.99,processor
B08MVX4XFN,"Android Tablet 10 inch, Octa-Core Processor, 4GB RAM, 64GB ROM, 5G-WiFi,Bluetooth, GPS, HD Display,3G-Unlocked,G9 (Silver)",3.5,13,89.99,processor
B08LNTKY5P,"Tablet 10 Inch, Winnovo P20, Android 10.0, Octa Core Processor, 3GB RAM, 64GB ROM, 13MP Rear Camera, 19201200 FHD IPS Display, Dual WiFi, Type-C, GPS, Support Keyboard, Brushed Metal Shell, Grey",4.8,8,169.0,processor
B07T8YG4P7,1 Pcs 30g GD900 Thermal Paste Processors for CPU Plaster Heatsink Heat Sink Plaster Cooler Water Cooler,4.6,46,12.95,processor
B009Z3WPK6,AMD Athlon 64 X2 5600+ 2.9 GHZ ADO5600IAA5DO SOCKET AM2 Dual Core Processor 65W,4.0,11,107.21,processor
B07HH5253T,"Lenovo IdeaCentre 720 Tower, 18L Desktop Computer (Ryzen 5 2600 Processor, 12 Dual Channel DDR4, 2TB, AMD Radeon RX 560 Graphics, Windows 10 Home), 90HY0007US, Warm Silver",4.3,4,741.9,processor
B07FJKRMB1,"Dell Inspiron 3670 Desktop, i3670-5207BLK-PUS, 8th Gen Intel Core i5-8400 Processor 9MB Cache, up to 4.0 GHz, 8GB 2666MHz DDR4 Memory, NVIDIA GTX1050, 1TB 7200 RPM Hard Drive, DVD-RW Drive, Black",3.9,20,699.99,processor
B07R6YLDDS,"Corsair Hydro Series, H100i RGB Platinum SE, 240mm Radiator, Dual LL120 RGB PWM Fans",4.7,5558,169.99,processor
B0881J19W9,"(Renewed) Newest Lenovo Tab 8 Tablet, 8.0 inch IPS HD(1280 x 800) Touchscreen, MT8163B Quad-Core Processor 1.30GHz, 1GB Memory, 16GB Storage, WiFi, Bluetooth, Android Nouga OS",3.8,181,79.99,processor
B07CKVW18G,Innovation Cooling Graphite Thermal Pad – Alternative to Thermal Paste/Grease (30 X 30mm),4.4,3557,9.97,processor
B07P32PJZD,"Logitech G MX518 Gaming Mouse Hero Sensor 16, 000 Dpi Arm Processor 8 Programmable Buttons (European Packaging) - Black",4.6,909,66.99,processor
B07Y6P817F,"2019 Dell Inspiron 15: 10th Gen Core i5-1035G1, 512GB SSD, 12GB RAM, 15.6"" Full HD Touch Display, Windows 10",4.2,16,779.0,processor
B08KD74Y5S,"Latest_Dell Inspiron 3880 Desktop, 10th Gen Intel Core i5-10400 Processor, 8GB DDR4 RAM, 1TB HDD, HDMI，Wireless+Bluetooth, Keyboard and Mouse, Window 10",5.0,4,525.0,processor
B087ZCBWFH,Synology 2 Bay NAS DiskStation DS220+ (Diskless),4.8,1940,299.99,processor
B07K1YFCQ6,3x3 Video Wall Controller HDMI HD TV 1080P Matrix Processor Splicer Splitter Support USB HDMI VGA AV Input 3x2 2x2 3x1 1x3-9 2x3 4x2 2x4,5.0,1,799.0,processor
B083BRVG28,"VANKYO MatrixPad S30 10 inch Octa-Core Tablet, 3GB RAM, 32GB Storage, 1080P Full HD Display, Android OS, 13MP Rear Camera, Bluetooth 5.0, 5G Wi-Fi, GPS, Silver",4.5,3225,139.99,processor
B00B4G70RU,Intel Pentium G2020 Processor BX80637G2020,4.5,18,50.0,processor
B07MC8CRVZ,"ARCTIC Freezer 34 eSports DUO - Tower CPU Cooler with BioniX P-Series case fan in push-pull, 120 mm PWM fan, for Intel and AMD socket - Red",4.7,2933,39.99,processor
B07G8KRY3T,"Professional Adjustable 32.3” – 52” Laptop DJ Mixer Tripod Stand | Lightweight & Portable 15.3” x 12.2” Tilted Tri-Pod Tray for Processors, Audio Controllers & Tablets | Raised Edges for Protection",4.7,407,59.99,processor
B07X6SFD57,"Lenovo ThinkPad T490s Business Laptop, 14.0"" FHD (1920 x 1080) IPS Touchscreen Notebook, Intel i7-8665U Processor, 8GB DDR4 RAM, 512GB PCIe SSD, Windows 10 Pro 64-bit",5.0,1,1299.99,processor
B07WZGVGW1,"Lenovo ThinkPad X1 Carbon 7th Gen 14"" FHD (1920x1080) Ultrabook - Intel Core i5-8265U Processor, 8GB RAM, 256GB PCIe-NVMe SSD, Windows 10 Pro 64-Bit",3.7,3,955.0,processor
B07VX5BYBR,"COOFUN Fanless Mini PC 4GB LPDDR4/ 64GB eMMC Windows 10 Quad Core Intel Celeron N3450 Processor Desktop Computer HDMI/VGA Port Support 2242 SSD,BT 4.2,3X USB 3.0,Auto Power on,Linux",4.1,21,109.99,processor
B08B8KB2RC,"MYMAHDI 10.1 inch Tablet, Quad-Core Processor, Android 9.0, 1280 x 800 IPS HD Display, 32GB Storage, Support Bluetooth, GPS, FM, WiFi for Portable Entertainment with Case, Black",4.1,46,95.99,processor
B01CNKF3A6,Intel Computer CPU 2.3 18 BX80660E52697V4,5.0,1,2669.95,processor
B08FPL6S4Y,"iBUYPOWER Gaming PC Computer Desktop Trace 4 9310 (AMD Ryzen 5 3600 3.6GHz, AMD Radeon RX 5500 XT 4GB, 8GB DDR4 RAM, 240GB SSD, WiFi ready, Windows 10 Home)",4.5,949,699.99,processor
B0148NNKTC,"Acer R240HY bidx 23.8-Inch IPS HDMI DVI VGA (1920 x 1080) Widescreen Monitor, Black",4.6,10230,112.99,processor
B07V39MHST,Raxxio H96 Max Android TV Box 9.0 with 4GB RAM 64GB ROM I 4K Smart Set Top Box Equipped RK3318 Quad-Core Processor 64bit Support 3D 2.4G/5G Dual WiFi/H.265/BT 4.0/USB 3.0 I Latest Model 2019,3.5,25,59.95,processor
B000MM37JW,Intel CORE 2 QUAD PROCESSOR Q6000 (BX80562Q6600),4.4,72,128.99,processor
B07MMSQ9ZM,"GPD Pocket 2 Amber Black [Latest Update-256GB SSD Version] 7"" Touch Screen Windows 10 Mini Portable Laptop UMPC Tablet PC CPU Intel Celeron Processor 3965Y lntel HD Graphics 615 8GB RAM/256GB ROM",4.3,161,619.99,processor
B086H5BS3W,"Lenovo Ideapad 330s 15.6"" Laptop, AMD Ryzen 5 2500U Quad-Core Processor, 8GB Memory, 256GB Storage, Windows 10, Platinum Grey- 81FB00HKUS (Renewed)",4.0,16,529.99,processor
B08BC8C9W6,Microsoft Laptop 3 (PKU-00001) | 13.3in (2256 x 1504) Touch-Screen | Intel Core i5 Processor | 8GB RAM | 256GB SSD Storage | Windows 10 Pro | (Alcantara) Platinum,5.0,1,1097.93,processor
B07P66F5N7,Latest_Dell Inspiron 3000 3670 Desktop Computer - Intel Core i5 (8th Gen) i5-8400 Processor - 8 GB DDR4 SDRAM - 1 TB HDD - Bluetooth - WiFi- DVD- HDMI- Windows 10 Ho,5.0,11,599.0,processor
B07YYB7JVG,"Android 9.0 TV Box 4GB RAM/32GB ROM, Amlogic S905X3 64-bit Quad core ARM, G31 MP2 GPU Processor,H.265 Decoding 2.4G/5G Dual-Band WiFi Smart TV Box - Model No.: X96 Air 4GB 32GB",3.3,2,56.99,processor
B089NXW7JF,"Latest_Dell Inspiron 7000 All-in-One Desktop 27"" FHD Display, 10th Generation Intel Core i5-10210U Processor, 8GB Memory, 128GB SSD + 1TB HDD, HDMI, WiFi, Webcam, Windows 10, Black, 1-Year McAfee",4.8,11,959.0,processor
B07K87MNTM,"Tablet 10 inch Android 8.1 Go, 10.1"" 5G WiFi Tablets,6000mAh Battery,Quad-Core Processor, 800x1280 Touch Screen Full HD Display,1.3GHz,16GB, Bluetooth,Black",3.9,424,97.99,processor
B07ZZH3D4B,"Lenovo ThinkCentre M720 Tiny M720q Desktop - Intel Core i5-8400T Processor, 16GB RAM, 512GB PCIe-NVMe SSD + 1TB HDD, Windows 10 Pro 64-bit",4.9,20,779.95,processor
B07662S766,GIGABYTE X399 Designare EX (AMD Ryzen Thread Ripper TR4/ATX /3X M.2/WIFI/Front & Rear USB 3.1/Dual Intel LAN/ Motherboard),4.2,71,399.99,processor
B07V49VNSB,Raxxio H96 Max Android TV Box 9.0 with 2GB RAM 16GB ROM I 4K Smart Set Top Box Equipped RK3318 Quad-Core Processor 64bit Support 3D 2.4G/5G Dual WiFi/H.265/BT 4.0/USB 3.0 I Latest Model 2019,4.0,6,49.95,processor
B08B3X4L95,"2020 HP Pavilion x360 14"" FHD WLED Touchscreen 2-in-1 Convertible Laptop, Intel Core i5-1035G1 up to 3.6GHz, 8GB DDR4, 256GB SSD, 802.11ac, Bluetooth, Webcam, HDMI, Fingerprint Reader, Windows 10",4.5,294,619.0,processor
B08B3C643L,"ASUS VivoBook 17.3"" FHD (1920 x1080) Display Laptop PC, AMD Ryzen 7 3700U Processor, 12GB DDR4, 512GB PCIe SSD, Bluetooth, Webcam, HDMI, WiFi, AMD Radeon RX Vega 10 Graphics, Windows 10 Home",4.5,66,748.0,processor
B079DQS77Q,"Thermal Paste, SYY 8 Grams CPU Paste Thermal Compound Paste Heatsink for IC/Processor/CPU/All Coolers, Carbon Based High Performance, Thermal Interface Material, CPU Thermal Paste",4.7,91,14.99,processor
B00603QXPM,Intel Core i7-3930K Hexa-Core Processor 3.2 Ghz 12 MB Cache LGA 2011 - BX80619I73930K,4.4,153,520.0,processor
B07YQ9HXQ2,"Hyundai Koral 7W4X 16GB Dual Camera Wi-Fi, Bluetooth, Quad-Core Processor, IPS Display, Android 9.0 GO [Black]",3.4,33,64.99,processor
B01NA80JML,"NETGEAR - R7000P-100NAS Nighthawk WiFi Router (R7000P) - AC2300 Wireless Speed (up to 2300 Mbps) | Up to 2000 sq ft Coverage & 35 Devices | 4 x 1G Ethernet and 2 USB ports | Armor Cybersecurity, Black",4.3,66745,172.59,processor
B07ZK587VK,"Dell OptiPlex 24 7470 All-in-One 1TB SSD 32GB RAM Extreme (Intel Core i9-9900 Processor Turbo Boost to 5.00GHz, 32 GB RAM, 1 TB SSD, 24-inch FullHD IPS, Win 10 Pro) PC Computer Desktop",4.4,2,2000.0,processor
B07K5H16HX,"Acer CB3-532 15.6inch HD Chromebook with 3x Faster WiFi, Intel Dual-Core Celeron N3060 upto 2.48GHz, 2GB RAM, 16GB SSD,HDMI,USB 3.0, Webcam, 12-Hrs Battery, Chrome OS (Renewed)",4.3,993,269.99,processor
B088D4SG65,"Computer Gaming Mouse Wired, Light Up Mouse for Laptop with Avago Processor, Adjustable DPI up to 4000, 7 Buttons, Ergonomic PC Gamer Mouse for Windows/Mac/Linux/Sega Nintendo",4.5,377,17.99,processor
B08GL8SSQ3,"Latest_Dell XPS 15 15.6"" 4K UHD OLED InfinityEdge Anti-Reflective Display, 9th Generation Intel Core i7-9750H Processor, 16GB RAM, 512 SSD, Wireless+Bluetooth, NVIDIA_GeForce GTX 1650，Window 10 Pro",5.0,1,1789.99,processor
B07PXC19WJ,"Lenovo Yoga 730 2-in-1 Laptop, 13.3"" Full HD IPS Touchscreen, Intel Core i7-8550U Processor up to 4.0GHz, 16GB DDR4 RAM, 512GB PCIe NVMe M.2 SSD, Wireless-AC, Bluetooth, Windows 10 Home, Iron Grey",3.9,23,999.0,processor
B08BC8SJRR,Microsoft Surface Book 3 (SMW-00001) | 15in (3240 x 2160) Touch-Screen | Intel Core i7 Processor | 32GB RAM | 1TB SSD Storage | Windows 10 Pro | GeForce GTX 1660 GPU,5.0,1,2953.0,processor
B07M64QXMN,"WD_Black 1TB SN750 NVMe Internal Gaming SSD - Gen3 PCIe, M.2 2280, 3D NAND - WDS100T3X0C",4.9,13118,129.99,processor
B07NGVQLD3,"HP EliteDesk 800 G1 Desktop, Intel Core i7 4770 3.4Ghz, 32GB DDR3 RAM, 1TB SSD Hard Drive, USB 3.0, DVDRW, Windows 10 Pro (Renewed)",4.5,164,419.0,processor
B07M9SMWMS,"Asus TUF Gaming Laptop, 15.6” IPS Level Full HD, AMD Ryzen 5 3550H Processor, AMD Radeon Rx 560X, 8GB DDR4, 256GB PCIe Nvme SSD, Gigabit WiFi, Windows 10 - FX505DY-ES51",4.3,380,923.0,processor
B07H1FBVPV,YAGALA T95 S1 Android 7.1 TV Box 1GB RAM 8GB ROM Amlogic S905W Quad core cortex-A53 Processor 2.4Ghz WiFi H.265 HDMI 2.0 Smart TV Box 100M Ethernet,4.0,171,27.99,processor
B08FBK2DK5,"CyberpowerPC Gamer Xtreme VR Gaming PC, Intel i5-10400F 2.9GHz, GeForce GTX 1660 Super 6GB, 8GB DDR4, 500GB NVMe SSD, WiFi Ready & Win 10 Home (GXiVR8060A10)",4.6,6171,999.0,processor
B07QVNG1DW,"Expert Connect 3x3 Video Wall Controller | 9 Channels | 1080p, HDMI 1.3, HDCP 1.3 Compliant | 1 HDMI Input & 9 Outputs | 13 Display Modes - 1x2, 1x3, 1x4, 2x1, 2x2, 2x3, 2x4, 3x1, 3x2, 3x3, 4x1, 4x2",4.4,62,699.99,processor
B07P9HYRWY,"USB 2.0 Spring Coiled Cable 3ft Extension Cord USB Type A Male to Mini B Male Charger Processors for Mobile Phone, MP3, Cameras",4.4,158,6.99,processor
B08RBCQX1W,"MSI MPG Z490 Gaming Edge WiFi ATX Gaming Motherboard (10th Gen Intel Core, LGA 1200 Socket, DDR4, CF, Dual M.2 Slots, USB 3.2 Gen 2, Wi-Fi 6, DP/HDMI, Mystic Light RGB) (Renewed)",5.0,2,199.0,processor
B081GMHQLR,"2020 Lenovo IdeaPad Laptop ComputerAMD A6-9220e 1.6GHz 4GB Memory 64GB eMMC Flash Memory 14"" AMD Radeon R4 AC WiFi Microsoft Office 365 Platinum Gray Windows 10 Home",4.0,1608,255.99,processor
B07QGR9H6T,"Lenovo Ideapad S940 Notebook, 14-Inch FHD (1920 X 1080) IPS Display, Intel Core i7-8565U Processor, 8GB DDR4 OnBoard RAM, 256GB NVMe SSD, Windows 10, 81R00004US, Iron Grey",4.4,14,848.88,processor
B08DRD9MW8,"Tablet 10 inch Android 9.0 Pie, Octa-Core Processor, 2GB RAM, 32GB ROM, IPS HD Display, Bluetooth 5.0, 5G WiFi, USB C,GPS",5.0,6,125.99,processor
B07J427KVK,"HP 2-in-1 Convertible Chromebook 11.6 HD IPS Touchscreen, Intel Celeron N3350 Processor, 4GB Ram 32GB SSD, Intel HD Graphics, Wi",4.4,107,399.99,processor
B086KKKT15,"Acer Swift 3 Thin & Light Laptop, 14"" Full HD IPS, AMD Ryzen 7 4700U Octa-Core with Radeon Graphics, 8GB LPDDR4, 512GB NVMe SSD, Wi-Fi 6, Backlit KB, Fingerprint Reader, Alexa Built-in, SF314-42-R9YN",4.6,1560,749.0,processor
B08C6XBCRT,"BLU G90 Pro – 6.5” HD+ Gaming Smartphone, Quad Camera, 128GB+4GB RAM – Purple Haze",4.5,725,219.99,processor
B08HYW1155,"XOTD 2 Pack ESP32S ESP32 Development Board 2.4GHz Dual-Mode WiFi+ Bluetooth Dual Cores Microcontroller Processor, Antenna Module with RF AMP Filter AP STA IDE Ultra Low Power",3.4,2,13.99,processor
B08GCYMHN7,"Lenovo 24"" FHD (1920 x 1080) IPS Touchscreen All-in-One Ideacentre A540 with AMD Qaud Core Ryzen 5 3400GE Processor up to 4.0 GHz, 12GB DDR4 RAM, 128GB PCIe SSD, and 2TB Traditional Hard Drive",5.0,2,999.0,processor
B08LS2TVWV,"USB 3.0 Expansion Spring Coiled Cable 5FT Spiral Flexible Active Extension USB 3.0 A-Male to A-Female Processors for Cell Phone,Printers, Cameras, Mouse and Other USB Computers (Black)",5.0,1,8.99,processor
B07YYB1W8G,"Android 9.0 TV Box 2GB RAM/16GB ROM, Amlogic S905X3 64-bit Quad core ARM, G31 MP2 GPU Processor,H.265 Decoding 2.4G WiFi Smart TV Box - Model No.: X96 Air 2GB 16GB",5.0,1,45.99,processor
B08G5CLT2N,"2020 Newest Lenovo Ideapad 3 Laptop, 15.6"" Full HD Display, 10th Gen Intel Core i3-1005G1 Dual-Core Processor, 8GB DDR4 Memory, 256GB PCIe SSD, HDMI, Wi-Fi, Bluetooth, Webcam, Windows 10 Home, Almond",5.0,1,500.0,processor
B08FKSZVY7,"Lenovo ideapad S145 15.6in IPS Laptop, Intel Core 10th Gen i3-1005G1 Dual-Core Processor, 4GB Memory, 128GB Solid State Drive, Windows 10, Dark Purple (Renewed)",4.4,16,409.99,processor
B00004Z7XX,Plantronics Standard Audio Processor Black (43404-31),3.0,19,129.68,processor
B07DLRLL8G,"FITE ON 9V AC Adapter for Boss Pedal AW-2 Auto Wah,CEB-3 Bass Chorus,AD-3 Acoustic Instrument Processor,AD-8 Acoustic Guitar Processor,Casio AD-5 AD-5MLE CTK720 Keyboard Switching Adapter Charger",4.6,20,6.99,processor
B07KDQW7Q1,"HP 15.6-Inch HD Touchscreen Laptop (Intel Pentium Silver N5000 1.1GHz, 4GB DDR4-2400 Memory, 1TB HDD, HDMI, HD Webcam, Win 10)",3.9,858,599.99,processor
B07TB9G2R6,"Dell OptiPlex 9020-SFF, Intel Core i5-4570 3.2GHZ, 16GB RAM, 512GB SSD Solid State, DVDRW, Windows 10 Pro 64bit (Renewed)",4.4,1110,260.0,processor
B085DP1ZZT,"ALSEYE Thermal Paste, Thermal Grease CPU Coolers High-Performance Heat Sink CPU Paste Easy to Use High Durability Paste Termica for Processor",4.4,36,9.04,processor
B07MK7X7R6,"RCA Galileo 11.5"" 32 GB Touchscreen Tablet Computer with Keyboard Case Quad-Core 1.3Ghz Processor 1GB Memory 32GB HDD Webcam Wifi Bluetooth Android 8.1 (ROSE GOLD)",3.8,60,399.98,processor
B08KTVSD4V,"Evoo 14.1” Ultra Slim Notebook - Elite Series, FHD Display, AMD Ryzen 5 3500U Processor with Radeon Vega 8 Graphics, 8GB RAM, 256GB SSD, HD Webcam, Windows 10 Home, Black (EVC141-12BK)",4.3,49,589.99,processor
B082VZP76P,"CHUWI HeroBox Windows 10 Mini PC,Intel Gemini-Lake N4100 Quad-Core Processor,8GB DDR4 256GB SSD,Expandable 2TB 2.5 Inch HDD,1TB SSD with 2.4GHz/5GHz Dual WiFi 1000Mbps/BT4.2",4.1,374,199.0,processor
B07VPGC74L,"2019 HP 17.3"" HD+ Flagship Home & Business Laptop, Intel Quad Core i5-8265U Processor Upto 3.9GHz, 8GB RAM, 256GB SSD, DVD-RW, WiFi, HDMI, GbE LAN, Bluetooth, Windows 10, Black",4.6,309,899.0,processor
B0757FYPBK,"SAMSUNG 11.6"" Chromebook with Intel N3060 up to 2.48GHz, 4GB Memory, 16GB eMMC Flash Memory, Bluetooth 4.0, USB 3.0, HDMI, Webcam, Chrome Operating System, Black",4.5,2638,294.0,processor
B07T96LQNT,"Latest_Dell Inspiron High Performance Desktop, 8th Generation Intel Core I5-8400 Processor, 8GB RAM, 1TB Hard Drive, DVD R/W, Wireless+Bluetooth, HDMI, Windows 10",4.4,8,564.99,processor
B07T6J3PXZ,VKLSVAN ESP-WROOM-32 ESP32 ESP-32S Development Board 2.4GHz Dual-Mode WiFi + Bluetooth Dual Cores Microcontroller Processor Module for Arduino IDE,4.1,17,7.95,processor
B01KU0CNL8,"HP 15-ay065, 15.6, Intel Core i3-5005U Processor, 6 GB RAM, 1 TB SATA, Windows 10 Notebook",4.2,22,458.98,processor
B07ZH64C73,"New Dell Inspiron 11 Chromebook , 11.6"" HD Non-Touchscreen Display, Intel Celeron Dual Core N3060 Processor, 4GB Ram, 16GB eMMc Flash Memory, WiFi, HDMI, USB3.0, Chrome OS (Renewed)",3.7,5,329.0,processor
B08HJD6S5G,"USB C to 3.5mm Jack Audio Adapter，Beevila Audio adapters 3.5mm Use Conexant CX21988 Audio Processor ，USB Type c Adapter converts CD Sound Quality，Compatible with Pixel, Samsung, Google, iPad Pro.",4.5,19,12.95,processor
B07MDYBSNF,"Antec Thermal Paste, High Performance Heatsink Paste for All CPU Coolers, High Durability and Easy to Apply - 4 Grams,Formula",4.6,218,12.99,processor
B0855FZP77,blackweb 50-FT | 15.2M HDMI Cable in-Wall Rated with Active Video Processor 4K HDR Ultra-HD Premium Certified HIGH Speed,4.5,4,26.48,processor
B07GTD8V3Y,"2018 Newest HP 17.3"" HD+ Notebook, Intel Core i5-8250U Processor, 24GB Memory: 16GB Intel Optane + 8GB RAM, 2TB Hard Drive, Optical Drive, HD Webcam, Backlit Keyboard, Windows 10, Natural Silver",3.8,7,749.97,processor
B01N5HCZVW,"NETGEAR ReadyNAS RN628XE4 8 Bay 32TB Enterprise Ultimate Performance NAS, 80TB Capacity Network Attached Storage, Intel Xeon 2.2GHz Quad Core Processor, 8GB RAM",3.9,38,4696.79,processor
B078T2T2FL,"Huawei Mate 10 Pro Unlocked Phone, 6"" 6GB/128GB, AI Processor, Dual Leica Camera, Water Resistant IP67, GSM Only - Midnight Blue (US Warranty)",4.4,817,600.0,processor
B01MSNGYD1,ZOTAC ZBOX CI325 Nano Fanless Mini PC Intel N3160 CPU Intel HD Graphics 4GB Memory 32GB SSD Windows 10 (ZBOX-CI325NANO-U-W2B),3.7,157,249.99,processor
B0835RPG2Z,"Dell Inspiron 2-in-1 5000 14.0"" HD LED-Backlit Touchscreen Laptop, Intel Core i3-8145U Processor,8GB DDR4 RAM,256GB SSD Windows 10 (Renewed)",3.5,2,599.88,processor
B07TLYWMYW,Sabrent 1TB Rocket NVMe 4.0 Gen4 PCIe M.2 Internal SSD Extreme Performance Solid State Drive (SB-ROCKET-NVMe4-1TB),4.8,7181,169.98,processor
B079HGN5QS,"Corsair RMX Series, RM750x, 750 Watt, 80+ Gold Certified, Fully Modular Power Supply",4.8,4055,189.95,processor
B00VULGQAQ,"MXTECHNIC USB 2.0 Expansion Spring Coiled Cable 4in Standard Spiral Flexible Active Extension USB 2.0 A-Male to A-Female Processors for Printers, Cameras, Mouse and Other USB Computers",4.4,215,6.99,processor
B01MDUH6HX,"RCA Galileo 11.5"" 32 GB Touchscreen Tablet Computer with Keyboard Case Quad-Core 1.3Ghz Processor 1GB Memory 32GB HDD Webcam Wifi Bluetooth Android 8.1 - Blue",3.9,1239,149.97,processor
B07V826V9D,Arctic Silver 3.5g High-Density Polysynthetic Silver Thermal Cooling Compound with LANSH Bonus Tool,4.7,727,6.99,processor
B01MD1PPIA,"2016 Newest Premium High Performance RCA Galileo Pro 11.5"" 32GB Touchscreen Tablet Computer with Keyboard Case Quad-Core 1.3Ghz Processor 1G Memory 32GB HDD Webcam Wifi Bluetooth Android 6.0-Pink",3.7,174,159.99,processor
B08KV8HP98,"Evoo Gaming 15.6” Laptop, FHD, 120Hz, AMD Ryzen 7 4800H Processor, NVIDIA GeForce RTX 2060, THX Spatial Audio, 512GB SSD, 16GB RAM, RGB Backlit Keyboard, HD Camera, Windows 10 Home, Black (EG-LP7-BK)",4.4,31,1194.72,processor
B08246MCL5,SongHe ESP-WROOM-32 ESP32 ESP-32S Development Board 2.4GHz Dual-Mode WiFi + Bluetooth Dual Cores Microcontroller Processor Integrated with Antenna RF AMP Filter AP STA for Arduino IDE（1pcs）,5.0,5,7.61,processor
B08LKJPR5X,Intel CPU BX8070110100F Core i3-10100F / 3.6GHz / 6MB LGA1200 4C / 8T,4.8,43,119.55,processor
B079JD7F7G,"TP-Link AC1750 Smart WiFi Router (Archer A7) - Dual Band Gigabit Wireless Internet Router for Home, Works with Alexa, VPN Server, Parental Control and QoS",4.5,38392,56.99,processor
B07CGJG12Q,LINK-MI TV04V 90 Degree Rotation Vertical Video Wall Controller 2x2 HDMI+DVI+VGA+CVBS+ATV+USB Image Stitching Splicing Processor,5.0,1,599.0,processor
B07K8TZ4JC,"2018 HP 270 21.5-Inch Full HD Display Slim Desktop PC, Intel Pentium G4560T Dual-Core Processor 4GB DDR4 RAM 1TB HDD DVD Writer WiFi HDMI VGA Keyboard + Mouse Windows 10",3.9,47,639.99,processor
B07CF31C1Q,MSI Performance GAMING AMD X470 Ryzen 2 AM4 DDR4 Onboard Graphics CFX ATX Motherboard (X470 GAMING PLUS),4.6,1888,224.99,processor
B072MRGHCK,Omnihil 2.0 USB Cable Compatible with Line 6 Helix LT Guitar Multi-Effects Processor,5.0,3,10.96,processor
B00IQ7OTZ6,Audio Control ACR3 Remote for Audio Control Processors,4.6,51,39.85,processor
B07B2SK3RK,"Raspberry Pi Zero WH @Pzsmocn Broadcom BCM2835,1GHz ARM11 Single-core Processor,512MB RAM, with Built-in WiFi and Bluetooth,40PIN pre-soldered GPIO Headers.",4.5,22,25.15,processor
B08GHF77KF,"HP 14 Laptop, AMD 3020e, 4 GB RAM, 64 GB eMMC Storage, 14-inch HD Display, Windows 10 Home in S Mode, Long Battery Life, Microsoft 365, (14-fq0070nr, 2020)",4.7,12,275.0,processor
B086N3KQ2F,"Latest_Dell XPS 15.6"" 4K UHD Touch IPS Display Laptop, 9th Generation Intel Core i7-9750H Processor, 16GB RAM, 512 SSD, Wireless+Bluetooth, NVIDIA_GeForce_GTX 1650 (512GB SSD)",5.0,2,1890.0,processor
B081JC228Y,"2020 HP 17.3"" Laptop Computer/ 8th Gen Intel Quad-Core i5-8265U Up to 3.9GHz/ 8GB DDR4 RAM/ 256GB PCIe SSD/ DVD/ Bluetooth 4.2/ USB 3.1/ HDMI/ Windows 10 Home/ Black",4.6,708,718.0,processor
B08PHL7NLF,"Venturer 14"" Luna Max [VCT9T48Q34RBM] Quad-Core 3GB RAM 64GB Storage IPS 1920 x 1080 FHD Touchscreen WiFi Bluetooth with Detachable Keyboard Android 10 Tablet",5.0,2,199.98,processor
B06ZXZ3SF1,"Slide Dual Sim 4.5"" Android 6, Unlocked Smartphone, Quad Core 1GHz Processor, 8GB Storage, Nationwide 4G LTE - White (SP4514)",2.9,33,39.95,processor
B083FJ8TSJ,"Philips Computer Monitors 322E1C 32"" Super-Curved Frameless Monitor, Full HD VA, 104% sRGB, Adaptive-Sync 75Hz, VESA, 4Yr Advance Replacement Warranty, Black/Silver",4.6,7963,199.99,processor
B07L7TFMB3,Roland Multi-Format HDMI Video Processor-4 x 2 (Switcher/Matrix/Split) (VP-42H),5.0,1,687.22,processor
B002SVDY3E,Honeywell Ademco 5819 Shock Processor and Transmitter,1.0,1,79.55,processor
B07SG1DY8T,"Omen by HP 2019 15-Inch Gaming Laptop, Intel i7-9750H Processor, NVIDIA GTX 1660Ti (6 GB), 8 GB RAM, 256 GB SSD, VR Ready, Windows 10 Home (15-dc1020nr, Black)",4.4,70,1099.99,processor
B07SH7DHBS,"Power Supply 600W Semi Modular 80+ Bronze, GAMEMAX VP-600-RGB",4.5,2169,59.99,processor
B08DJXYMJL,"Lenovo IdeaPad 5 Laptop: 10th Gen Core i5-1035G1, 16GB RAM, 512GB SSD, 15.6"" Full HD IPS Touchscreen",4.6,138,759.0,processor
B081NPNGWR,"CaseBuy Premium Ultra Thin Keyboard Cover for All 2020+ MacBook Pro 13"" with Magic Keyboard or Apple Silicon M1 Processor (Model A2338 A2289 A2141 A2251) & 2019+ MacBook Pro 16 inch A2141, US Layout",4.3,46,4.99,processor
B00LSCG80A,Wiseup 4Ch Realtime Color Video Quad Splitter CCTV Security Mulitplexer Processor OSD Menu with Audio,4.7,3,68.99,processor
B07WHYBN7D,"Bewinner Desktop PC Motherboard,DDR2/DDR3 4 USB Port Desktop Mainboard for AM2/AM3 Phenom II/Athlon II/Sempron and Other Processors,Rare Support for IDE Interface",1.0,1,68.49,processor
B07VNNFZPL,"GENNEL G106-20g Thermal Compound Paste for Coolers, Heat Sink Paste, High Heat Dissipation Performance, Thermal Grease Paste jar for Processor/CPU/PS4/Laptop",4.2,10,9.99,processor
B07DLG8W2R,"Acer Aspire XC-330-UR11 Desktop, AMD A-Series Dual-Core A6-9220 Processor, 4GB DDR4, 1TB HDD, 8X DVD, 802.11ac WiFi, Windows 10 Home",3.6,30,429.99,processor
B08L9QSRCP,"2020 HP High Performance Chromebook 14"" FHD 1929x1080 - Intel Celeron N4000 - 4GB Memory - 32GB eMMC - Natural Silver",4.7,78,260.98,processor
B08NCQ1VXP,"Intel NUC NUC8i5BEH Mini PC/HTPC,  i5 NUC Tall with Kingston 16GB DDR4 Ram, 256GB SSD, Intel Core i5-8259U 2.3GHz, Windows 10 Home, Bluetooth, WiFi, 4k Support (16GB Ram + 256GB SSD)",5.0,2,459.99,processor
B082XH47ZY,Replacement New CPU Cooling Fan with Heatsink for Intel LGA1150 LGA1151 LGA1155 LGA1156 Socket Celeron/Pentium/i3/i5/i7 Processors Series Fan E97379-003 CNDP751K50 DTC-DAB16 DC12V 0.60A 4-PIN,3.7,7,9.99,processor
B076MHLVTT,J-Tech Digital Video Wall Controller 3X3 2X2 1X4 3X1. Multi-Channel inputs HDMI VGA AV USB for LCD LED Video Wall Display with Cascading Function Control4 Driver Avaliable[JTECH-VW02],4.0,42,449.95,processor
B08JQ15ZP1,"Mini PC AWOW Mini Desktop Computer Windows 10 Intel Celeron J4115 with 8GB DDR4/NVMe M.2 256GB SSD, Triple Display, 4K@60Hz, Extended SSD 2TB(Optional), WiFi, HDMI 2.0, USB4, BT5.0, Gigabit Ethernet",4.5,237,249.99,processor
B07FJ8KJF9,"HP 15-CE198WM 15.6″ FHD Gaming Laptop, Windows 10, Intel Core i7-8750H Processor, NVIDIA GeForce GTX 1060 Graphics, 16GB DDR4 SDRAM Memory, 1TB Hard Drive + 256GB SSD, Backlit Keyboard",4.3,35,1405.99,processor
B08HLJQPCH,"ACEPC T11 Mini PC, 4GB DDR3, 64GB eMMC, Windows 10 Pro Mini Desktop Computer with Intel Atom Z8350 Processor, Support Dual Display, 4K HD, Bluetooth 4.2, Gigabit LAN, Dual Band WiFi",4.6,12,129.9,processor
B00D60060K,Intel Core i7-4800MQ 2.70GHz Processor 2.7 4 NA BX80647I74800MQ,5.0,2,429.95,processor
B083ZKLKQK,"ONN 100005209 10.1 inch GB RAM +16GB ROM1.3GHz Quad Core Processor 1280 x 800 Android Tablet with Detachable Keyboard, Navy",3.6,8,121.48,processor
B00JHVNDVQ,"Listen Technologies LT-800-072-01 Stationary 72 MHz RF Transmitter, LCD Display, Channel Lock Status Information, Built-in Auto Processor, 57 Selectable Channels, VU Level Meter, Dark Gray",5.0,1,429.0,processor
