ASIN,name,rating,review_count,price,product_type
B08JCZSP55,"Contixo V9-3-32 7 Inch Kids Tablet, 2GB RAM 32 GB ROM, Android 10 Tablet, Educational Tablets for Kids, Parental Control Pre Installed Learning Game Apps WiFi Bluetooth Tablets for Kids, Blue",4.1,283,69.95,processor
B015AKZYUK,SparkFun Photon Weather Shield,4.6,2,36.95,processor
B08CDJQ79Z,"MINIX J50C-4 Intel Pentium Silver Mini PC with Windows 10 Pro (64-bit), Designed to Power Your Entertainment and Productivity Needs. (4GB+240GB/Mini PC)",5.0,1,279.9,processor
B078V6DS9F,"D'Addario Accessories IEC to NEMA Plug Power Cable+, 10FT (North America)",4.7,144,28.99,processor
B07YNLZVLL,SilverStone Technology SST-PF120-ARGB Permafrost 120mm All in One Multi-Chamber Addressable RGB CPU Liquid Cooler Supports Intel/AMD,4.0,37,79.99,processor
B00E0HD0S8,uxcell 10 Pcs Plastic Mounting Clip for Intel 4 Way CPU Coolers,4.0,43,8.64,processor
B07WTZC3JS,"Dell Inspiron 15 5000, 2019 15.6"" FHD Touchscreen Laptop, Intel 4-Core i5-8265U, 12GB RAM, 256GB PCIe SSD by 16GB Optane, 1TB HDD, Backlit KB Fingerprint Reader MaxxAudio Win 10/Accessories Bundle",4.1,258,999.0,processor
B0759HDW97,Fujifilm X-E3 Mirrorless Digital Camera w/XF23mmF2 R WR Kit - Silver,4.6,176,850.36,processor
B07M8TZ1KM,ARRIS SURFboard mAX Pro Mesh AX11000 Wi-Fi 6 AX Router (W31),4.0,69,399.99,processor
B01I04G89E,HP Compaq 6300 Pro Desktop PC - Intel Core i5-3470 3.2GHz 8GB 500GB DVDRW Windows 10 Pro (Renewed),3.6,27,167.0,processor
B07DHXHP2V,Supermicro AS-2013S-C0R 2U AMD EPYC 7000-Series Server,1.6,2,1249.99,processor
B00TRB2CHW,"BlackBerry Passport, Black 32GB (AT&T)",3.5,47,328.88,processor
B086YKT4X2,"INKEE Benbox Video Transmitter hdmi Wireless hdmi Transmitter and Receiver,WiFi Wireless Live Transmission to 3 Devices Built-in Cold Shoe",4.0,10,109.0,processor
B07PZV3D39,"uxcell Antistatic Shield Shielding Bag, Flat Open Top Anti Static Bag for Electronic Devices, 11x15 inch(270x380mm), 20 PCS",5.0,1,14.49,processor
B07S2Z68Q6,"Dell Latitude 5300 13.3"" Touchscreen 2 in 1 Notebook - 1920 X 1080 - Core i7 i7-8665U - 16GB RAM - 256GB SSD",5.0,1,1209.89,processor
B014V6SXUW,Verifone Vx520 Swivel & Tilt Stand,4.3,43,53.0,processor
B08B3D2C1T,"HONOR 9X 6.59 inch Smartphone, 4GB 128GB, 48 MP AI Dual Camera, 16MP Pop-up Front Selfie Camera, Dual SIM GSM Unlocked 4G LTE International Version EU Plug US Adapter, Blue",4.5,64,229.99,processor
B01N4OZN8B,"Microsoft Surface Pro 4 (Intel Core M, 4GB RAM, 128GB) with Windows 10 Anniversary Update",4.0,236,649.0,processor
B07TX7BYTZ,OLOy DDR4 RAM 16GB (2x8GB) 2400 MHz CL17 1.2V 288-Pin Desktop Gaming UDIMM for Intel (MD4U082417IFDA),4.6,114,62.99,processor
B07FKT5CTH,"ASUS PRIME B450-PLUS AMD AM4 (3rd/2nd/1st Gen Ryzen ATX motherboard (1Gb LAN,HDMI 2.0b, DVI, front USB 3.2 Gen 1, USB 3.1 Gen 2 and AURA Sync RGB Lighting)",4.5,567,154.0,processor
B08F3HXFSG,"JIES USB Microphone for Computer, Podcast Microphone for Recording, Conferencing, Dictation, Gaming, Streaming, Gaming Microphone Compatible with PC, Mac, Laptop, PS4, Plug-and-Play Desktop Mic",3.9,171,7.99,processor
B08JPJMLKH,"Lenovo Chromebook Flex 3 11.6"" HD (1366 x 768) TouchScreen 2-in-1 Laptop, Intel Celeron N4020, 4GB DDR4, 64GB eMMC, Webcam, WiFi, Bluetooth, MicroSD Card Reader, Chrome Os w/ 64GB Micro SD Card",5.0,1,419.0,processor
B00V7NOV3Q,CABLEDECONN Fiber 8K 4K DisplayPort Cable DP 1.4 HBR3 8K@60Hz 4K@144Hz High Speed 32.4Gbps Optical Fiber Slim and Flexible DP to DP Cable 15m 50ft,4.6,824,93.99,processor
B07NXJSGGN,"Naxa Electronics NID-1020 10.1"""" Core Tablet with Android OS 8.1, Black",4.0,3,84.08,processor
B07FB94T1K,"RCA to 3.5mm, DuKabel 3.5mm to RCA Cable 2-Male RCA to AUX Cable Braided 1/8 to RCA Stereo Cable RCA Cable [24k Gold-Plated & Double-Shielded] -Top Series(4ft/1.2m)",4.7,693,7.99,processor
B01BCLXO7Q,Le Grand Macho RT (with Fan TY-147B),4.6,128,79.99,processor
B08D8RFRSL,"ASUS ROG Zephyrus S17 Gaming Laptop, 17.3” 300Hz FHD Display, NVIDIA GeForce RTX 2070 Super, Intel Core i7-10750H, 16GB DDR4, 1TB SSD, Per-Key RGB Keyboard, Thunderbolt 3, Win10 Pro, GX701LWS-XS76",4.1,81,2149.99,processor
B07PXSH1YS,"uxcell Antistatic Shield Shielding Bag, Flat Open Top Anti Static Bag for Electronic Devices, 11x15 inch(270x380mm), 10 PCS",5.0,1,9.49,processor
B00IQ2ECNU,Audio Control Three.2 in-Dash Pre-Amp Equalizer/Subwoofer Crossover with Dual Auxiliary Inputs,4.5,65,299.95,processor
B081LDZW2Q,ORICO 512GB Mini M.2 NVME Portable SSD External Solid State Drive Hard Drive Up to 940MB/s with 3D NAND/USB 3.1 Gen 2 Type C for Laptop Mac Phones and More (SSD Included),4.5,29,89.99,processor
B0018R6AGM,"Hosa GTR-205R Straight to Right Angle Guitar Cable, 5 Feet Black",4.7,1342,8.95,processor
B07NMZTSK1,"Microsoft Surface Book 13.5"" (Intel Core i5, 8GB RAM, 256 GB)",4.2,110,999.0,processor
B07K7WGJFN,"Smart Touch ST66 4G LTE Smart Watch for Men Android 6.0 & iOS, GPS Bluetooth Fitness Tracker | Real-Time Notifications | Smartwatch w/ Changeable Bands | IP67 Waterproof, Pedometer, Heart Rate & Sleep",3.3,15,169.99,processor
B06XNVFVFG,"AZUMI Kinzo A55 OLi - 5.5"" High Definition AMOLED Display 32GB +3GB 4G LTE US GSM Unlocked Dual Sim Smartphone Black (AT&T and T-Mobile Compatible)",3.2,30,97.99,processor
B07W8629TN,"Mini PC,Mini PC Windows 10 with Intel Apollo N3450 Quad Core,Desktop Computer with 8GB RAM 64GB EMMC 128GB SSD,Mini Desktop Computer with Intel HD Graphics 500 GPU",3.8,8,150.39,processor
B014GDGHDU,"Shuttle XPC Nano NC01U3 Intel Broadwell Core i3-5005U, Support 4K Ultra HD Video, DDR3L SODIMM Max 16GB",4.0,3,309.99,processor
B07WJYY49W,"Canon Mirrorless Camera [EOS M6 Mark II] (Body) for Vlogging|CMOS (APS-C) Sensor| Dual Pixel CMOS Auto Focus| Wi-Fi |Bluetooth and 4K Video, Black",4.6,90,849.0,processor
B0888MH9QY,"Blackview Smart Watch for Android Phones and iOS Phones, Smart Watches for Men Women, Fitness Tracker Watch with Heart Rate Sleep Monitor, 1.3"" Full Touch Screen, 5ATM Waterproof Pedometer(46mm)…",4.0,3245,49.88,processor
B01N2RSRDE,Nady ENC DUET Wireless Dual Channel Instrument/Guitar System with 2 Wireless Guitar Transmitters,4.0,10,142.89,processor
B00004Z5AS,Maxell 3.5 HD 1.44MB Pre-Formatted MF2HD 10-Pack,4.4,309,21.96,processor
B086H46S3T,"Sabbat True Wireless Earbuds, E12 Ultra Bluetooth 5.0 Headphones with Charging Case, Noise Cancelling Built in Mic TWS HiFi Bass Stereo in Ear 30 Hours Playtime Earphones for Android iPhone (Red)",3.9,9,79.88,processor
B086T4Z4F8,"Dell XPS 13 7390 13.3"" Intel Core I7-10710U (6-CORE, UP to 4.70Ghz) 512GB PCIe SSD 16GB RAM FHD 1080P IPS WiFi 6 AX Windows 10 Professional",5.0,2,1294.99,processor
B07S31R54B,"HP EliteBook 840 G6 14"" Notebook - 1920 x 1080 - Core i7 i7-8665U - 16 GB RAM - 512 GB SSD - Windows 10 Pro 64-bit - Intel UHD Graphics 620 - in-Plane Switching (IPS) Technology - English Keyboar",3.6,4,1801.0,processor
B07KT6361R,Intel Neural Compute Stick 2,4.5,143,84.47,processor
B08DXSD1SX,"Acer Swift 3 14"" Laptop: Ryzen 5 4500U, 512GB PCIe SSD, 8GB RAM",4.6,25,629.99,processor
B08JQFLJ5F,"Beelink Mini PC Computer GK55 Windows 10 Pro Intel J4125 8GB DDR4 RAM 128GB SSD 4K@60Hz Dual HDMI 2.4G/5G WiFi, Dual Gigabit Ethernet, HDD Extension, Support Auto Power On",4.7,8,249.0,processor
B089KKPVV9,"Lenovo ThinkPad T14 Gen 1 20S0002UUS 14"" Notebook - 1366 x 768 - Core i5 i5-10210U - 8 GB RAM - 256 GB SSD - Windows 10 Pro 64-bit - Intel UHD Graphics",5.0,1,929.49,processor
B089KW6BQ6,EOS 800D Digital SLR Camera with 18-55 is STM Lens Black - Expo Advanced Accessories Bundle,4.5,2,739.99,processor
B07P7TFKRH,"Western Digital 500GB WD Blue SN500 NVMe Internal SSD - Gen3 PCIe, M.2 2280, 3D NAND, Up to 1700 MB/s - WDS500G1B0C",4.8,922,67.95,processor
B01BTPDEKM,EVERCOOL EC-LGA115X-ES Universal Screw Mounting for Socket 115X Cooler w/Back Pl,5.0,2,8.45,processor
B01LZZ99C3,CPU Tray Holder for Intel LGA 775 or LGA 1156 (ESD Packaging) - Pack of 2,5.0,4,12.99,processor
B07CR9T4FH,TracFone LG Premier Pro 4G LTE Prepaid Smartphone (Locked) - Black - 16GB - Sim Card Included - CDMA,4.1,54,74.9,processor
B08FR297GN,QNAP TS-h886 8 Bay Enterprise NAS with Intel Xeon D-1622 CPU and Four 2.5GbE Ports,3.8,4,1679.0,processor
B07XRPRY2T,"Optical Audio Cable Digital Toslink Cable 6.6ft - [ Ultra-Durable Nylon Braided Jacket ] Slim Flexible and Durable Fiber Optic Cord for Home Theater, Sound bar, TV, PS4, Xbox and More",4.7,161,6.99,processor
B07QXTYXF1,NETGEAR Nighthawk Smart WiFi Router (RS400) - AC2300 Wireless Speed (up to 2300 Mbps) | Up to 2000 sq ft Coverage & 35 Devices | 4 x 1G Ethernet and 2 USB Ports | Includes 3 Years of Armor Security,4.4,642,274.0,processor
B08DF8YQZF,"Kids Tablet PC,Large Battery 7 inch Kids Tablets with 1G Ram 16GB Storage Safety Eye Protection IPS Screen Premium Parents Control Pre-Installed Educational APP Google Play",3.8,15,57.99,processor
B0823M8FNY,"pendoo Android TV Box 10.0 4GB RAM 32GB ROM,[2021 Newest] X11 PRO TV Box with Mini Wireless Keyboard Allwinner H616 Quad-Core 64bit with Dual-WiFi 5GHz/2.4GHz BT 4.2, USB 3.0 6K H.265 Android TV Box",3.8,363,74.99,processor
B08HJ7K8KL,ILamourCar Ubuntu Linux 20.04 Latest Version - 2020 16GB USB Flash Drive | English Version - Silver,3.9,32,13.99,processor
B07YNJ4X2P,"Microsoft Surface Pro X – 13"" Touch-Screen – SQ1 - 16GB Memory - 256GB Solid State Drive – Wifi, 4G Lte – Matte Black, (Model: QFM-00001)",4.0,51,1227.77,processor
B07PXSGN4P,"uxcell Antistatic Shield Shielding Bag, Flat Open Top Anti Static Bag for Electronic Devices, 4x10 inch(100x250mm), 100 PCS",5.0,1,17.99,processor
B087LW2KFG,"Razer Blade 15 Gaming Laptop: Intel Core i7-9750H 6 Core, NVIDIA GeForce GTX 1660 Ti, 15.6"" FHD 144Hz, 16GB RAM, 256GB SSD, CNC Aluminum, Chroma RGB Lighting, Thunderbolt 3, 9th Gen i7-9750H",4.5,580,1348.0,processor
B08CVBTBZ9,"Karaoke Microphone for Kids,NASUM Karaoke Microphone with LED, 3-in-1 Bluetooth Karaoke Microphone Wireless, Christmas Birthday Home Party for Android/iPhone,Best Gift Singing Toy for Kid (Rose Gold)…",4.5,197,16.99,processor
B07XC98GGZ,"QNAP TVS-672N-i3-4G-US 6 Bay NAS with 5GbE, Intel Core i3, Dual PCIe and Dual M.2 Slots, 4GB DDR4 memory, USB Type-C Ports, Supports SSD Cache",4.8,41,1299.0,processor
B08BJ5LMVZ,"GTMEDIA V8 UHD 4K Ultra HD Digital Satellite Receiver, FTA H.265 TV Sat Decoder DVB-S/S2/S2X+T/T2/Cable/ISDB-T/ATSC-C, Built-in 2.4G WiFi, Supports CA Smart Card, Biss Auto-roll",2.5,3,77.99,processor
B07F1Z2DPT,Roku 3800RW Streaming Stick GEN6 with Voice Remote - Black,4.5,435,130.0,processor
B00DWFQ42I,"Noctua NH-U12DX i4, Premium CPU Cooler for Intel Xeon LGA20xx (Brown)",4.8,117,64.95,processor
B071ZNK6MP,"Tailwind Vx805 3"" Compact Pole Mount PIN Pad Stand, Adhesive Installation, Black",3.7,8,58.0,processor
B08BJYCN99,"BONAOK 2021 Wireless Bluetooth Karaoke Microphone, Magic Voice Portable Handheld Mic Speaker Machine Home Party Birthday Presentations for iPhone/Android/iPad/Sony/PC/All Smartphones(Silver)",4.7,117,51.99,processor
B0883FNJJS,DP-UB9000P-K Region Zone Code Free 4K Ultra HD Blu Ray Player with OREI - 4K UHD - WiFi - PAL/NTSC - 110V-240V - Worldwide Voltage,4.8,5,1490.0,processor
B01LZSO43C,10x Computer CPU Packaging Clamshell Container for for LGA775 LGA1150 LGA1155 LGA1156,5.0,4,19.99,processor
B01H1S1ZQ6,CANalyst-II USB to CAN Analyzer CAN-Bus Converter Adapter Support ZLGCANpro,2.8,10,89.98,processor
B000FBSREU,WD WD3200KSRTL Caviar 320 GB SATA 3.5-Inch Hard Drive,3.7,63,54.69,processor
B088D57QD7,MXQ TV Cube Android 7.1 ATV TV Box with Build-in AI Speaker AI Assistant S905W Quard-core 2G+16G 4K up to 60fps T2R2 WiFi 2.4GHz/5GHz BT 4.2 Voice Control Smart TV Media Player for Home Entertainment,3.4,14,33.99,processor
B08HYBPY64,Deal4GO CPU Cooling Fan (95W CPU) 0KTDJC KTDJC w/Thermal Heatsink T57JF 0T57JF Assembly for Dell XPS Tower 8910 8920 8930 Precision T3640 T3630 T3620 T3610,3.0,1,81.99,processor
B01AK9T6JG,"Cablelera North American Hospital Grade Power Cord, HG NEMA 5-15P to IEC C13, 6', 14AWG, 125V (ZADA32PC-06)",5.0,6,12.1,processor
B008634VJY,"StarTech.com USB to Serial RS232 Adapter - DB9 Serial DCE Adapter Cable with FTDI – Null Modem - USB 1.1 / 2.0 – Bus-Powered (ICUSB232FTN), Black",4.6,1139,21.68,processor
B076BBL9HL,Canon PowerShot G1 X Mark III Digital Camera - Wi-Fi Enabled,4.3,43,999.0,processor
B074QGBXSP,PCI-E PCI Express 4X to USB 3.1 Gen 2 (10 Gbps) 2-Port Type C Expansion Card Asmedia Chipset for Windows 7 /8/8.1/10/Linux Kernel (2XType C),4.2,253,32.99,processor
B079GFD84R,ASRock J4005B-ITX Intel J4005 2.7GHz/DDR4/SATA3/USB3.1/GbE/Mini-ITX Motherboard & CPU Combo,4.3,52,77.99,processor
B06W2HQ21D,"Dell OptiPlex 7050 Small Form Factor Desktop Computer, Intel Core i5-7500, 8GB DDR4, 256GB Solid State Drive, Windows 10 Pro (1735H)",3.6,7,649.95,processor
B07WCYP3Q8,"2019 Flagship HP Chromebook 15.6"" IPS FHD 1080p Touchscreen Core i3-8130u 4GB 128GB eMMC Ceramic White",4.5,16,649.0,processor
B07H8M3TJY,"Intel NUC 8 Performance-G Mini PC (NUC8i7HVKVA) - Core i7 100W, 16GB RAM, 1TB SSD",3.9,16,1829.99,processor
B00S7YA5FQ,Cryorig H7 Tower Cooler,4.6,1213,99.0,processor
B08D6KM1B6,"2020 HP Envy X360 2-in-1 15.6"" FHD IPS Touchscreen Premium Laptop PC | AMD 4th Gen Ryzen 5 Six-Core 4500U | 16GB RAM | 512GB PCIe SSD | Backlit Keyboard | Fingerprint Reader | WiFi 6 | Windows 10",3.9,12,835.99,processor
B07BS5LZ97,"Asustor AS4004T | Personal Cloud | 1.6GHz Dual-Core, 2GB RAM DDR4, 10GbE Port | Network Attached Storage NAS (4-Bay Diskless)",4.4,23,341.0,processor
B081JDP378,GIGABYTE TRX40 AORUS Xtreme (sTRX/AMD/TRX40/Fins-Array Heatsink/16+3 Phases Infineon Digital VRM/Gen 4 AIC with 4 X M.2 NVMe/Intel WiFi 6/Intel Dual 10GbE LAN/XL-ATX/Motherboard),4.0,37,838.63,processor
B085VHF693,Standard Intel LGA20XX Narrow Retention Kit for Asetek Liquid Coolers - Basic Kit for Easy Setup and Quick Installation,4.1,7,9.0,processor
B00ICLLX32,Soundstream TWT.5 1-Inch TWT Series PEI Dome Tweeters,4.3,574,14.99,processor
B0811ZZMP9,Lenovo Yoga C940-14 FHD Touch - 10th gen i7-1065G7-12GB - 512GB SSD - Gray,4.5,132,1125.0,processor
B083SN18D9,"ABKONCORE RGB CPU Cooler CT404B, 4 Continuous Direct Contact Heatpipes, Dual 120mm PWM SYNC Addressable RGB Fans with SYNC 61 LED Modes for Intel LGA1151/1200, AMD AM4/Ryzen CPUs(120mm Dual)",4.4,108,37.5,processor
B08L7JDKWS,Daarcin 40pcs Mixed 4 Size Open Top Antistatic Bag and Resealable Antistatic Bags ESD Shielding Bag for Motherboard Hard Drive Video Card LCD Screen with Anti-Static Labels(Assorted Sizes),4.8,41,12.59,processor
B07Q7Z84HQ,"HP Envy X360, 15.6"" FHD IPS Touchscreen, 2019 Flagship 2 in 1 Laptop, AMD Quad-Core Ryzen 5 2500U(>i7-7500U), 8GB DDR4, 256GB PCle SSD, AMD Radeon Vega 8 802.11ac Backlit Keyboard Windows Ink Win 10",4.4,472,699.0,processor
B07WK4VG58,"REXQualis Nano V3.0, Nano Board CH340 / ATmega328P with USB Cable, Compatible with Arduino Nano V3.0 (Nano x 3 with Cable)",4.6,278,13.86,processor
B07XGD3TKH,Kensington Pro Fit Ergonomic Wireless Keyboard - Grey (K75402US),4.0,1483,49.99,processor
B07TZ6B73F,"PC Steam Game Controller, IFYOO ONE Pro Wired USB Gaming Gamepad Joystick Compatible with Computer/Laptop(Windows 10/8/7/XP), Android(Phone/Tablet/TV/Box), PS3 - [Black&Silver]",4.1,919,22.99,processor
B081ZBJZKW,"Lenovo Ideapad S145 14.0"" HD Pentium 5405U 2.3GHz 4GB RAM 128GB SSD (Renewed)",4.1,80,319.99,processor
B07SDP37GM,"5.0 Bluetooth Hands-Free Calling Crystal Sound 2.0 inch Multicolor Screen Wireless Radio Adapter,3 USB Ports Charger QC3.0/3.4A AUX TF Card U-Disk Music Player",4.2,250,26.99,processor
B089VWHGJH,"GOODAN Audio Video Capture Cards HDMI to USB 1080p USB2.0 Record via DSLR Camcorder Action Cam for High Definition Acquisition, Live Broadcasting (Black)",4.1,54,13.99,processor
B088BDNRDX,"Mini PC, XIDU PhilMac Mini Desktop Computer with 8GB DDR4/128GB eMMC, Intel J4115, 4K HD Home Server, Retro Gaming Computer, 2.4/5G WiFi, 1000M LAN, HDMI&VGA Output, Windows 10",4.1,16,199.99,processor
B07PH5X868,"Kingdel Fanless Mini PC, Powerful Mini Desktop Computer, Intel i5 8th Gen. 4 Cores CPU, 16GB DDR4 RAM, 250GB SSD, 4096x2304, HD Port, LAN, VGA, 4xUSB 3.0, Wi-Fi, Windows 10 Pro",4.2,53,585.0,processor
B07YRXNSKZ,Alcatel Cingular Flip 2 AT&T Prepaid GoPhone 4g LTE 4GB Flip Phone (Black) (4 GB),4.8,7,83.99,processor
B079JW29K7,Mogami 3080 AES/EBU Digital Cable 110 Ohm | Neutrik XLR Female - XLR Male | HiFi - 16.40 ft / 5.0 m,4.7,60,56.9,processor
B08GYF1X7F,"Wireless Karaoke Microphone, Bluetooth Portable Handheld Microphone Karaoke Machine with LED Lights, Singing & Recording Speaker Mic Best Gift Toy for Kids Adults Birthday/Party/Christmas/Home KTV",4.6,160,18.99,processor
B086Q99S3D,"HIDevolution ASUS ROG Zephyrus G14 GA401IV, Moonlight White 14"" FHD 120Hz, 3.0 GHz Ryzen 9 4900HS, RTX 2060 Max-Q, 16 GB 3200MHz RAM, 1 TB PCIe SSD",4.3,63,1399.0,processor
B00E6ZAZ8W,Archgon MD-3102S-U3 USB 3.0 External Blu-ray Combo,3.9,119,76.9,processor
B005T44LES,"AudioQuest Evergreen 1m 3.28 feet RCA to RCA 1m 3'4""",4.5,312,49.95,processor
B086BXS765,IN WIN B1 Mini-ITX Tower Case - 200W 80 Plus Gold Power Supply Included - Tempered Glass Top Panel - 80mm Side Fan (IW-CS-B1BLK-PS200W),4.6,68,85.0,processor
B08G1JPFHT,10W+ Bass Bluetooth Speaker Soundnova N6 Small Portable Premium IP65 Waterproof Bluetooth Speaker 12h Playtime Support TF Card/U Disk Perfect Outdoor Mini Wireless Speaker for Shower Camping Beach,4.5,67,19.99,processor
B08161PM18,"Android 10 TV Box, Amlogic S905X3 4GB 128GB Support 8K 4K 3D Ultral HD Video Smart tv Box with Mini Keyboard",4.1,40,59.89,processor
B0130K4H5A,SparkFun WiFi Shield - ESP8266,3.6,19,18.95,processor
B07YPZW255,WeiMeet 6 Packs Aluminum Heat Sink Heatsink Module Cooler Fin for High Power Transistor Semiconductor Devices with 8 Pieces Fins 100mmx 25mm x 10mm,4.5,2,8.99,processor
B00FS83U42,ASUS Tinker Board S Quad-Core 1.8GHz SoC 2GB RAM 16GB eMMC storage GB LAN Wi-Fi & GPIO connectivity Motherboards,4.0,429,103.99,processor
B08KQ3CCZN,"YUNZII SK64 64 Keys Hot Swappable Optical Mechanical Keyboard with ABS Shine-Through Keycaps, RGB Backlit, Programmable for Win/Mac/Gaming (Gateron Optical Red, White)",3.8,6,65.99,processor
B07CGC8S9N,"2018 Flagship Dell Inspiron 11.6"" Business 2 in 1 HD Touchscreen Laptop/Tablet - AMD Dual-Core A9-9420e 8GB DDR4 128GB SSD AMD Radeon R5 MaxxAudio Bluetooth 802.11bgn HDMI HD Webcam USB 3.1 Windows 10",2.9,6,399.0,processor
B087YVJ44P,"OMEN 15 Gaming Laptop, NVIDIA GeForce GTX 1660 Ti, Intel Core i7-10750H, 8 GB DDR4 RAM, 512 GB PCIe NVMe SSD, 15.6"" Full HD, Windows 10 Home, RGB Keyboard (15-dh1020nr, 2020 Model)",4.7,8,1199.99,processor
B0748FXDHS,GinTai DC Jack Socket Port Cable W Connector Replacement for Dell Inspiron P66F P66F001 P66F002,5.0,4,8.63,processor
B01B96248O,ASRock Rack Motherboard C236 WSI,3.8,19,212.99,processor
B014MRW45U,"Asustor AS6202T | Network Attached Storage | 1.6GHz Quad-Core, 4GB RAM | Personal Private Cloud | Home or Business Data Media Server (2 Bay Diskless NAS)",3.3,35,434.99,processor
B07GBRB3SC,Total Wireless LG Rebel 4 4G LTE Prepaid Smartphone (Locked) - Black - 16GB - Sim Card Included - CDMA,4.3,532,29.87,processor
B07TK2LV3S,Dasaita 10 inch Large Screen Single Din Android 10.0 Car Stereo for Toyota Tundra 2007 to 2013 and Sequoia 2008 to 2018. Radio with GPS Navigation 4G Ram 64G ROM Built in DSP Dash Kit GPS Meomery Card,4.6,20,489.99,processor
B00E1JGFA0,"Noctua NH-U9DX i4, Premium CPU Cooler for Intel Xeon LGA20xx (Brown)",4.7,257,59.9,processor
B07FS8W8LX,"HRX Package 100pcs Premium Anti-Static Resealable Bags, 5.9 X 7.9 inches Plastic Static Free Bag for Motherboard SSD HDD Computer Electronic Components",4.8,186,13.87,processor
B08P4PJ5DJ,"Arducam for Raspberry Pi Camera, 13MP AR1335 OBISP MIPI Camera Module with Low Distortion M12 Lens, Support All Raspberry Pi Models, Jetson Nano",4.2,16,49.99,processor
B01IVQYDB6,"upHere CPU Cooler Blue LED 4 Copper Heat Pipes 92mm PWM Fan Aluminum Fins for AMD Ryzen/Intel, C92B",4.4,539,19.98,processor
B06XVZZSKQ,"Canon PowerShot SX530 HS 16.0 MP CMOS Digital Camera with 50x Optical is Zoom (24-1200mm), Built-in WiFi, 3-Inch LCD and 1080P Full HD Video (Black) (Renewed)",4.4,37,289.0,processor
B07Y2DS1JV,"Monoprice 138627 Ultra High Speed HDMI Cable - 30 Feet - Black, 8K@120Hz, Dynamic HDR, 48Gbps, Fiber Optic, Earc, AOC, Ycbcr 4: - Slimrun AV Series",3.6,37,219.99,processor
B017V59Z0W,Amp Powers 3.5mm 1/8 Male Mini Plug to Male Mini Plug monaural Mono Audio Cable 2 Pack,4.8,50,12.99,processor
B07WMNXB4V,"UCTRONICS Clear Case for Raspberry Pi 4 Model B, Pi 4B Acrylic Case with Cooling Fan and Heatsinks",3.7,21,9.99,processor
B07WZH89NP,"QOTOM Q190G4-S02 Barebone Industrial PC Gateway Router (No RAM No SSD) - Intel J1900 4 Gigabit NICs, Support Freebsd Linux (No RAM, No SSD)",3.8,15,162.0,processor
B08N499Q2J,GIGABYTE Z490 AORUS Master WF (Intel LGA 1200/Z490/ATX/Triple M.2/SATA 6Gb/s/USB 3.2 Gen 2/ WiFi 6/2.5 GbE LAN/CPU/VRM Liquid Cooler 360/Gaming Motherboard),4.5,124,699.99,processor
B07V5KS95V,"Samsung Galaxy Note 10+ Plus Factory Unlocked Cell Phone with 256GB (U.S. Warranty), Aura White/ Note10+",4.6,380,1019.35,processor
B07LDF5YX3,"Dell Inspiron 2-in-1 14"" Full HD Touch-Screen Chromebook - Intel Core i3, 4GB Memory, 128GB eMMC Solid State Drive Urban Gray Chrome OS",4.5,431,580.0,processor
B07QTLB1D9,"Nokia 4.2 - Android One (Pie) - 32 GB - 13+2 MP Dual Camera - Dual SIM Unlocked Smartphone (AT&T/T-Mobile/MetroPCS/Cricket/H2O) - 5.71"" HD+ Screen - Black - U.S. Warranty",4.0,133,189.0,processor
B07TB9KWQT,"Lenovo ThinkPad T490 20N20008US 14"" Notebook - 1366 X 768 - Core i5 I5-8265U - 8 GB RAM - 256 GB SSD - Glossy Black - Windows 10 Pro 64-bit - Intel UHD Graphics 620 - Twisted Nematic (TN) - Engli",5.0,4,849.99,processor
B07YQ83M66,TC M90N-1 I7/1.9 4C 16GB 512GB W10P 64,4.5,2,769.64,processor
B06X9ZKFRK,"OEM Lenovo ThinkCentre M75q Tiny M75q-1, AMD Ryzen 5 Pro 3400GE, 8GB RAM, 256GB SSD NVMe, W10P, Business Desktop",3.2,12,599.95,processor
B0763G5KGN,Epic IT Service - AMD Radeon HD 7570 1GB 1024MB GDDR5 Low Profile Video Card with Display Port and DVI for SFF / Slim Size Computer,4.0,3,105.0,processor
B07NST5L1N,VAIO SX14 - Intel Core i7-8565U | 16GB Memory (RAM) | 1TB PCIe SSD | Windows 10 Pro | 14.0-Inch Ultra HD 4K (3840x2160) Display | Black,3.9,47,1799.0,processor
B07NNHGKH4,"uxcell Antistatic Shield Shielding Bag, Flat Open Top Anti Static Bag for Electronic Devices, 10x14 inch(250x350mm), 20 PCS",5.0,1,12.99,processor
B07FPPZQK9,Canon PowerShot SX420 Digital Camera w/ 42x Optical Zoom - Wi-Fi & NFC Enabled (Black) - Deal-Expo Bundle,4.2,97,299.99,processor
B07SHDLPD4,SYGAV Android 10 Car Radio Stereo for Subaru Forester WRX XV Crosstrek Impreza with Carplay GPS Navigation HD 1280x720 Touch Screen Head Unit,4.2,23,529.99,processor
B083GK2GXR,"MSI ProSeries AMD A320 1st, 2nd, 3rd Gen Ryzen Compliant AM4 DDR4 HDMI DVI USB 3 Micro-ATX Motherboard (A320M-A PRO)",4.5,2034,81.99,processor
B07X5FTYHH,OptiPlex 7000 7450 All in One i5-6500 128GB SSD 8GB (Renewed),5.0,1,552.49,processor
B089N64KZF,"Mini Video Capture Card, HDMI to USB 2.0 Video Audio Game Capture Converter, 4k Output Stream and Record in 1080P, for PS4/Xbox One/Switch/Windows/Mac OS/Camcorder/DSLR/OBS (Black)",4.4,59,14.99,processor
B00FEKXYZO,AudioQuest Irish Red RCA Male to RCA Male Subwoofer Cable - 9.84 ft. (3m),4.5,22,99.95,processor
B07Y5R5RXP,"Zymkey 4i, Security Module for Raspberry Pi | Root File Encryption | Secure Key Storage | Physical Tamper Detection",5.0,1,43.0,processor
B07V4H4FBL,"Samsung Galaxy Note 10+ Factory Unlocked Cell Phone with 256 GB (U.S. Warranty), Aura Black/ Note10+",4.6,915,1047.58,processor
B07QXZHXBW,"Home Wireless Bluetooth Speaker, 30W Powered Speakers, Wireless Stereo Pairing, 10H Playtime, 2.0 HiFi Surround Sound, Luxurious Style for Home, Bookshelf, TV, Desktop",4.3,291,64.99,processor
B08BLQ6GQX,anidees Aluminum Heat Sinks fanless Pi Case with Silicone Thermal Pad for Raspberry Pi 4 Model B Silver (AI-PI4-SG-PRO),5.0,15,29.9,processor
B004K3628W,Plantronics Replacement Cord QD to Mod (Home Office Products/Mobile-Cordless-Office Headsets),5.0,2,16.51,processor
B08H4WS5XR,XLEADER SoundAngel Sport3 - Bluetooth 5.1 Sports Earbuds IPX7 Waterproof Wireless Running Headphones in Ear with LED Display Charging Case TWS Earphones with Micphones for Workout Fittness Gym Red,4.4,16,32.99,processor
B0794DG2WF,ODROID HC2 : Home Cloud Two,3.9,24,73.19,processor
B079C8L5PR,"Dell Latitude D5V23 Notebook (Windows 10 Pro, Intel i5-8250U, 12.5"" LCD Screen, Storage: 256 GB, RAM: 8 GB) Black",3.5,3,957.56,processor
B086Y77P1D,"iProda Kids Tablet, 7 inch HD Display Android 9.0, Panda Toddler Tablet with 2GB RAM & 16GB ROM, Educational Games, Parental Controls, Best Gift for Kids",3.9,126,69.98,processor
B085RD7DHT,"CAQL New CPU Cooling Fan for Toshiba Satellite S55T-A S55T-A5132 S55T-A5136 S55T-A5138 S55T-A5156 S55T-A5161 S55T-A5189 S55T-A5237 S55T-A5238 S55T-A5258NR S55D-A5366, P/N: H000047170 KSB0805HB-CL2C",5.0,2,14.99,processor
B0827LR7KC,"2020 Newest HP 14"" Premium FHD IPS Laptop, 10th Gen i5-1035G4 (up to 3.7GHz, Beat i7-7500), 8GB RAM, 256GB SSD, HDMI, WiFi, Bluetooth, Windows 10",4.3,82,629.0,processor
B07HH61PYF,"Intel BOXNUC8i3CYSN1 NUC 8 Home, a Mini PC with Windows 10",4.4,10,269.88,processor
B08L98D63D,"7 Inch Tablet for Kids Edition, Android 10 Tablet 3GB ROM+32GB RAM/128GB with WiFi 4000mAh Parental Control Dual Camera Children Tablets (Red)",4.5,14,94.99,processor
B08BLSF473,GPD Win Max [512GB SSD Storage] Mini Handheld Windows 10 Video Game Console Gameplayer 8 Inch 1280 × 800 Touch Screen Laptop Notebook UMPC Tablet PC CPU Intel i5-1035G7 16GB RAM,4.4,37,1019.99,processor
B07ZRV21ST,Caterpillar CAT S52 Dual-SIM 64GB + 4GB RAM IP68 Rugged (GSM Only | No CDMA) Factory Unlocked 4G/LTE Smartphone (Black),4.1,64,359.99,processor
B07GPPC7BS,"FiiO M3K HiFi MP3 Player with Digital Voice Recorder,24 Hours Playback and Expandable Up to 512GB with Independent Lock & Volume Control,Silver",4.1,964,59.99,processor
