ASIN,name,rating,review_count,price,product_type
B07STGGQ18,"AMD Ryzen 5 3600 6-Core, 12-Thread Unlocked Desktop Processor with Wraith Stealth Cooler",4.9,24478,199.99,processor
B089J731BX,Intel Core i9-9900K Desktop Processor 8 Cores up to 5.0GHz Unlocked LGA1151 300 Series 95W (BX806849900K),4.8,397,364.95,processor
B07HHN6KBZ,Intel Core i7-9700K Desktop Processor 8 Cores up to 4.9 GHz Turbo unlocked LGA1151 300 Series 95W,4.8,6344,319.9,processor
B08BKRZB4Z,"Industrial Rugged Fanless Silent Mini PC Computer, Intel i5, Intel i7, Intel i9, Up to 8 Cores/16 Threads, Up to 1TB SSD, 32GB RAM, Wi-Fi, 4K, Windows 10 (Intel i5-8500T CPU + 240GB SSD + 8GB RAM)",4.5,2,799.99,processor
B07MGBZWDZ,Intel BX80684I99900KF Intel Core i9-9900KF Desktop Processor 8 Cores up to 5.0 GHz Turbo Unlocked Without Processor Graphics LGA1151 300 Series 95W,4.6,1165,379.99,processor
B08K4H1DT3,"GIM MB8 ATX Case, Mid-Tower PC Gaming Chassis, Compact Computer Case with Tempered Glass Panel, 4 RGB Fans Pre-Installed, Water-Cooling Ready, Cable Management System - Black",4.2,17,75.99,processor
B086MHTK5C,Intel Core i9-10900F Desktop Processor 10 Cores up to 5.2 GHz Without Processor Graphics LGA 1200 (Intel 400 Series chipset) 65W,4.8,52,419.99,processor
B08BKRQHWQ,"Industrial Rugged Fanless Silent Mini PC Computer, Intel i5, Intel i7, Intel i9, Up to 8 Cores/16 Threads, Up to 1TB SSD, 32GB RAM, Wi-Fi, 4K, Windows 10 (Intel i7-8700T CPU + 500GB SSD + 16GB RAM)",4.5,2,1199.99,processor
B07S8DWXT3,Intel Core i7-9700F Desktop Processor 8 Core 3 GHz speed (Up to 4.7 GHz) Without Processor Graphics LGA1151 300 Series 65W (BX80684I79700F),4.7,499,284.99,processor
B07SXNDKNM,"AMD Ryzen 5 3400G 4-core, 8-Thread Unlocked Desktop Processor with Radeon RX Graphics",4.8,4186,259.98,processor
B086C1PK2Y,"Cooler Master MasterLiquid ML120L RGB V2, Close-Loop AIO CPU Liquid Cooler, 120 Radiator, SickleFlow 120mm, RGB Lighting, 3rd Gen Dual Chamber Pump for AMD Ryzen/Intel LGA1200/1151",4.5,5463,59.99,processor
B07B428V2L,AMD Ryzen 5 2600X Processor with Wraith Spire Cooler - YD260XBCAFBOX,4.8,6695,204.99,processor
B01MYTY55V,Intel BX80677G3930 7th Gen Celeron Desktop Processors,4.6,647,89.89,processor
B086MW76DW,"Intel Core i5-10500 Desktop Processor 6 Cores up to 4.5 GHz LGA1200 (Intel 400 Series chipset) 65W, Model Number: BX8070110500",4.8,62,218.0,processor
B08H4YTTLP,"ASUS VivoBook 15 F515 Thin and Light Laptop, 15.6” FHD Display, Intel Core i3-1005G1 Processor, 4GB DDR4 RAM, 128GB PCIe SSD, Fingerprint Reader, Windows 10 Home in S Mode, Slate Grey, F515JA-AH31",4.5,3101,349.99,processor
B081V6W99V,"ASUS Laptop L210 Ultra Thin Laptop, 11.6” HD Display, Intel Celeron N4020 Processor, 4GB RAM, 64GB Storage, NumberPad, Windows 10 Home in S Mode with One Year of Microsoft 365 Personal, L210MA-DB01",4.3,5155,248.99,processor
B0759FTRZL,Intel Core i3-8100 Desktop Processor 4 Cores up to 3.6 GHz Turbo Unlocked LGA1151 300 Series 95W,4.6,2064,170.68,processor
B07CG2PGY6,"Noctua NF-P12 redux-1700 PWM, High Performance Cooling Fan, 4-Pin, 1700 RPM (120mm, Grey)",4.8,5693,13.9,processor
B012M8LXQW,"Intel BX80662I76700K 4512 Core i7 6700K 4.00 GHz Unlocked Quad Core Sky Lake Desktop Processor, Socket LGA 1151",4.7,2217,299.0,processor
B07R7Q3JZH,Intel Core i3-9100F Desktop Processor 4 Core Up to 4.2 GHz without Processor Graphics LGA1151 300 Series 65W,4.7,2084,129.99,processor
B07MN8YJ67,"HP Chromebook 14-inch Laptop with 180-Degree Hinge, Full HD Screen, AMD Dual-Core A4-9120 Processor, 4 GB SDRAM, 32 GB eMMC Storage, Chrome OS (14-db0040nr, Chalkboard Gray)",4.4,3382,279.0,processor
B08NHWVWYR,Lenovo Ideapad 3 81WA00B1US Intel Pentium Gold 6405U Dual Core Processor 4GB RAM 128GB Solid State Drive HD LED Backlit Anti-Glare Display,4.5,32,298.0,processor
B077P6V599,ISEEVY Video Wall Controller 2x2 Video Wall Processor Support HDMI DVI VGA USB inputs for 4 TV Splicing,3.8,19,269.0,processor
B086226DDB,"Lenovo Flex 5 14"" 2-in-1 Laptop, 14.0"" FHD (1920 x 1080) Touch Display, AMD Ryzen 5 4500U Processor, 16GB DDR4, 256GB SSD, AMD Radeon Graphics, Digital Pen Included, Win 10, 81X20005US, Graphite Grey",4.5,3220,689.99,processor
B08166SLDF,"AMD Ryzen 5 5600X 6-core, 12-Thread Unlocked Desktop Processor with Wraith Stealth Cooler",4.8,764,419.99,processor
B089N4WC3L,"Lenovo IdeaCentre AIO 3, 24"" All-in-One Computer, AMD Ryzen 5 4500U Mobile Processor, Integrated Graphics, 16GB DDR4, 512GB M.2 Name SSD, DVD RW Drive, Windows 10, F0EW005SUS, Business Black",4.7,268,672.73,processor
B086145M8P,"Beelink U55 Mini PC Windows 10 Pro, Intel Core i3-5005U Processor 8GB RAM 256GB SSD, 4K HD Dual HDMI USB 3.0 Port, Dual Band WiFi Gigabit Ethernet BT 4.2 Support Auto Power On (Beelink U55 8GB/256GB)",4.4,183,289.89,processor
B08D63M8BH,"ASUS VivoBook Flip 14 Thin and Light 2-in-1 Laptop, 14” HD Touchscreen, Intel Celeron N4020 Processor, 4GB DDR4, 64GB Storage, Windows 10 Home in S Mode, Light Grey, TPM, Fingerprint, J401MA-DB02",4.5,49,299.99,processor
B01AWH063Q,WD 12TB My Cloud EX2 Ultra Network Attached Storage - NAS - WDBVBZ0120JCH-NESN,4.2,1663,479.99,processor
B07XW266D9,"SAMSUNG XE350XBA-K01US Chromebook 4 + Chrome OS 15.6"" Full HD Intel Celeron Processor N4000 4GB RAM 32Gb Emmc Gigabit Wi-Fi, Silver",4.4,1977,277.73,processor
B07X1RP9GG,ISEEVY 4K Video Wall Controller 2x2 1x2 2x1 1x3 3x1 1x4 4x1 Video Wall Processor Support 3840x2160@30 HDMI inputs for 4 TV Splicing,3.7,33,289.0,processor
B06XVWBSLH,Stetsom STX 2448 Digital Audio Processor,4.5,67,109.0,processor
B08KHGPMR8,"ASUS Desktop S300, Intel Core i5-10400 Processor, 16GB DDR4 RAM, 512GB PCIe SSD, DVD Drive, Windows 10 Home, Wired Keyboard & Mouse Included, Black, S300MA-DH501",4.5,10,649.99,processor
B08HLD3N5C,"2020 Newest Lenovo IdeaPad 3 15"" Laptop, AMD Ryzen 5 3500U Quad-Core Processor, 8GB Memory, 256GB Solid State Drive, Windows 10, Abyss Blue, 81W1009DUS (Google Classroom Compatible)",4.7,4,477.0,processor
B08KH2Q1FG,"ASUS TUF Gaming Laptop, 15.6” 144Hz Full HD IPS-Type Display, Intel Core i7-9750H Processor, GeForce GTX 1650, 8GB DDR4, 512GB PCIe SSD, Gigabit Wi-Fi 5, Windows 10 Home, FX505GT-AB73",4.6,675,849.0,processor
B08D7WD544,"Lenovo 11.6in Ideapad Chromebook, Intel Celeron N4020 Dual-Core Processor, 4GB RAM, 32GB eMMC SSD, WiFi, Bluetooth, Chrome OS (Renewed)",4.5,80,209.0,processor
B07XQQTVS3,"Samsung Chromebook 4 Chrome OS 11.6"" HD Intel Celeron Processor N4000 4GB RAM 32GB eMMC Gigabit Wi-Fi - XE310XBA-K01US",4.5,1547,195.99,processor
B07598HLB4,Intel Core i7-8700 Desktop Processor 6 Cores up to 4.6 GHz LGA 1151 300 Series 65W,4.8,5023,339.99,processor
B079D3DBNM,AMD Ryzen 3 2200G Processor with Radeon Vega 8 Graphics - YD2200C5FBBOX,4.7,4257,254.95,processor
B075JYHNB1,EXPERT 6 CH 28 Band EQ Bluetooth Processor (PX2CONNECT),4.6,34,137.0,processor
B08FRNCPXF,"Latest Gen 8 Lenovo ThinkPad X1 Carbon 14"" FHD Ultrabook (400 nits) with 10th Gen Intel i7-10510U Processor up to 4.90 GHz, 1 TB PCIe SSD, 16GB RAM, and Windows 10 Pro",4.7,28,1599.0,processor
B08MKKXPK3,"Mini PC Intel Celeron J4125 Windows 10 Pro (up to 2.7GHz) 8GB DDR4/256GB SSD Beelink GK55 Mini Desktop Computer Support Dual displays 4K@60hz HDMI, WiFi, Gigabit Ethernet (8GB+256GB/Celeron J4125)",4.1,50,259.0,processor
B088X29HF6,"Acer Aspire TC-895-UA91 Desktop, 10th Gen Intel Core i3-10100 4-Core Processor, 8GB 2666MHz DDR4, 512GB NVMe M.2 SSD, 8X DVD, 802.11ax Wi-Fi 6, USB 3.2 Type C, Windows 10 Home",4.6,267,419.99,processor
B08H2DRCWZ,Intel Core i9-10900K Ten Core Desktop Processor Up to 5.3 GHz Comet Lake - OEM Tray Version,4.4,27,639.99,processor
B08HLK6N12,AK1 Mini PC Intel Celeron Apollo Lake J3455 Processor(up to 2.3GHz) Windows 10 Pro(64-bit) Desktop Computer[4GB RAM/64GB mSATA SSD/2.4G+5G Dual WiFi/Gigabit Ethernet/4K],4.6,46,149.9,processor
B087SD98F4,"HP Pavilion Laptop, 15.6"" Full HD IPS Touchscreen, 10th Gen Intel Core i5-1035G1 Processor up to 3.60GHz, 12GB RAM, 512GB PCIe NVMe SSD, Backlit Keyboard, HDMI, Wireless-AC, Bluetooth, Windows 10 Home",4.4,545,688.0,processor
B0815JGCXP,"AMD Ryzen Threadripper 3960X 24-Core, 48-Thread Unlocked Desktop Processor, without Cooler,Medium",4.9,179,1424.0,processor
B08NV3QKMF,"Newest HP Stream 14inch HD(1366x768) Display, Intel Celeron N4000 Dual-Core Processor, 4GB RAM, 64GB eMMC, HDMI, WiFi, Webcam, Bluetooth, Win10 S, Blue, With SA Mouse(Renewed)",4.5,9,269.99,processor
B07ZHR1953,"HP Chromebook 14-inch Laptop with 180-Degree Hinge, Touchscreen Display, AMD Dual-Core A4-9120 Processor, 4 GB SDRAM, 32 GB eMMC Storage, Chrome OS (14-db0060nr, Chalkboard Gray) (Renewed)",4.3,60,249.95,processor
B08JPDTFTS,"Mini PC, Intel Celeron J3455 Processor(up to 2.3GHz) Windows 10 Pro(64-bit) Mini Desktop Computer with HDMI/VGA Port,8GB DDR3/256GB SSD,Gigabit Ethernet,Dual Band Wi-Fi,Bluetooth 4.2,4K HD",4.3,437,249.99,processor
B07QY4RN79,"ASUS Chromebook Flip C434 2-In-1 Laptop- 14"" Full HD 4-Way NanoEdge Touchscreen, Intel Core M3-8100Y Processor, 8GB RAM, 64GB eMMC Storage, Backlit KB, Chrome OS- C434TA-DS384T Silver",4.4,1787,649.0,processor
B07FP6PFZ9,Depusheng X5 Karaoke Professional Digital Audio Processor Can Set via a PC Interface Prevent Howling,4.2,30,139.0,processor
B085RZDVL5,"Intel Celeron N3450 Processor (Z8350 Upgraded up to 2.4 Ghz) Mini Pc Windows 10 home 64 bit 4GB DDR4 / 64GB eMMC Mini Desktop Computer, 2.4G/5G Dual WiFi, Gigabit Ethernet, 4K HD HDMI & VGA Ports, BT4",4.2,217,169.89,processor
B0872K4XCJ,"Lenovo IdeaPad 3 15"" Laptop, 15.6"" HD (1366 x 768) Display, AMD Ryzen 3 3250U Processor, 4GB DDR4 Onboard RAM, 128GB SSD, AMD Radeon Vega 3 Graphics, Windows 10, 81W10094US, Business Black",4.5,354,359.99,processor
B08K3NGK2Z,"2020 Acer Aspire 3 15.6"" Full HD 1080P Laptop PC, Intel Core i5-1035G1 Quad-Core Processor, 8GB DDR4 RAM, 256GB SSD, Ethernet, HDMI, Wi-Fi, Webcam, Numeric Keypad, Windows 10 Home, Steel Gray",4.3,16,515.0,processor
B07H9JSTHG,Intel Xeon X5690 Six Core Processor 3.46 GHz 6.4 GT/s 12MB Smart Cache LGA-1366 130W SLBVX (Renewed),4.7,54,119.0,processor
B08NZSSR84,"Newest_Lenovo IdeaPad 3 15"" HD Touch Screen Laptop, Intel 10th Gen i5-1035G1 Processor, 12GB RAM, 256GB SSD, Webcam, WiFi+Bluetooth, HDMI, Windows 10 S, 1-Month AimCare Support",5.0,2,589.0,processor
B086383HC7,"Lenovo Chromebook Flex 5 13"" Laptop, FHD (1920 x 1080) Touch Display, Intel Core i3-10110U Processor, 4GB DDR4 Onboard RAM, 64GB SSD, Intel Integrated Graphics, Chrome OS, 82B80006UX, Graphite Grey",4.6,1326,389.0,processor
B08HVQQ498,"Mini PC Windows 10 Pro 8GB LPDDR4 256GB SSD Intel Celeron J4125 Processor Quad Core(up to 2.7GHz),4X USB 3.0 Ports,2X Gigabit Ethernet,Digital Mic,4K HDMI 2.0/DP Port,Dual Band Wi-Fi,BT 5.0",4.5,104,249.99,processor
B0892WCGZM,"ASUS Laptop L406 Thin and Light Laptop, 14” HD Display, Intel Celeron N4000 Processor, 4GB RAM, 64GB eMMC Storage, Wi-Fi 5, Windows 10, Microsoft 365, Slate Gray, L406MA-WH02",4.4,467,298.99,processor
B08J9W81MK,"Venturer 11.6"" [WT9L11P44GD51] 2-in-1 Windows Tablet PC with Keyboard, 64GB Storage, 4GB RAM, Intel Pentium N5000 Processor, FHD Display",4.5,22,219.99,processor
B0734ZVZHP,"Lenovo ThinkCentre M82 SFF Business Desktop Computer, Intel Core i5-3470 Quad-Core Processor 3.6GHz, 16GB RAM, 2TB HDD, DVD RW, USB, WIFI, Windows 10 Professional (Renewed)",4.4,131,200.0,processor
B08D3X9RF6,"Newest Flagship HP Chromebook, 11.6"" HD (1366 x 768) Display, Intel Celeron Processor N3350, 4GB LPDDR2, 32GB eMMC, Chrome OS, HD Graphics 500, 11A-NB0013DX, Ash Gray",4.6,590,207.98,processor
B083G77SWG,"HP 14inch Touchscreen Chromebook AMD Dual-Core A4-9120 Processor, 4GB DDR4 Memory, 32GB eMMC Storage, AMD Radeon Graphics, Chrome OS-Gray(Renewed) (Touch/14inch/A49120)",4.1,63,280.0,processor
B0872S365N,"Beelink U57 Mini PC with Intel Core i5-5257u Processor(up to 3.10 GHz)&Windows 10 Pro,8G DDR3L/128G SSD High Performance Business Mini Computer,2.4G/5G Dual WiFi,BT4.2,Dual HDMI Ports",4.5,251,329.0,processor
B083J7DVY1,"VANKYO MatrixPad S20 10 inch Tablet, Octa-Core Processor, 3GB RAM, 32GB ROM, Android OS, IPS HD Display, Bluetooth 5.0, 5G WiFi, GPS, USB C,Metal Body, Gray",4.5,2445,129.99,processor
B07GLV1VC7,"Lenovo Chromebook S330 Laptop, 14-Inch FHD (1920 x 1080) Display, MediaTek MT8173C Processor, 4GB LPDDR3, 64GB eMMC, Chrome OS, 81JW0000US, Business Black",4.4,1124,329.99,processor
B0862269YP,"Lenovo IdeaPad 3 14"" Laptop, 14.0"" FHD 1920 x 1080 Display, AMD Ryzen 5 3500U Processor, 8GB DDR4 RAM, 256GB SSD, AMD Radeon Vega 8 Graphics, Narrow Bezel, Windows 10, 81W0003QUS, Abyss Blue",4.5,2486,515.0,processor
B089W26FCB,ASRock B550M-HDV Supports 3rd Gen AMD AM4 Ryzen/Future AMD Ryzen Processors Motherboard,4.4,106,80.99,processor
B01E742BM4,LINK-MI TV04 2x2 Video Wall Controller USB+HDMI+VGA+AV TV HDMI with Fully-Digital Processing Channel Inside 180 Degree Rotate,4.2,36,369.0,processor
B076GZS6NB,Taramp's Pro 2.6 S Digital Audio Processor,4.4,71,143.0,processor
B08MVC4WX7,"Thomson WWN14I3-4SL128 14.1 inch 2.0GHz Intel Core i3 4GB DDRL RAM | 128GB SSD Intel HD 5500 Graphic Processor, Windows 10 Home, Silver",5.0,1,329.9,processor
B08LGP41CW,"2020 Lenovo Yoga C740 2-in-1 14"" Full HD 1080p Touchscreen Laptop PC, Intel Core i5-10210U Quad Core Processor, 8GB DDR4 RAM, 256GB SSD, Backlit Keyboard, Webcam, WiFi, Bluetooth, Windows 10, Mica",4.8,26,659.0,processor
B01LZLPO1H,"Dell Optiplex 7010 Business Desktop Computer (Intel Quad Core i5 up to 3.8GHz Processor), 8GB RAM, 500GB HDD, DVD, Windows 10 Professional (Renewed)",4.3,422,169.99,processor
B086YDLPQR,LG Gram 17'' Ultra-Lightweight Laptop with 10th Gen Intel Core Processor w/Intel Iris Plus,4.7,24,1374.0,processor
B07GM2J11Q,"Lenovo Chromebook C330 2-in-1 Convertible Laptop, 11.6-Inch HD (1366 x 768) IPS Display, MediaTek MT8173C Processor, 4GB LPDDR3, 64 GB eMMC, Chrome OS, 81HY0000US, Blizzard White",4.5,6055,326.99,processor
B07T2876DK,"Desktop Mini PC Quad-Core Intel Celeron J3160 Processor (up to 2.24GHz),4G DDR3/NVMe 128GB SSD Windows 10 HDMI&VGA Display with Cooling System USB 3.0/BT 4.2 Dual WiFi",4.1,155,179.99,processor
B08951L2W1,"Acer Chromebox CXI3-UA91 Mini PC, Intel Celeron 3867U Processor 1.8GHz, 4GB DDR4 -Memory, 128GB M.2 SSD, 802.11ac Wi-Fi 5, USB Type-C, Chrome OS, Keyboard and -Mouse Included",4.2,185,220.24,processor
B001UMED0U,Soundstream BX-20Z Digital Bass Reconstruction Processor,4.3,456,64.99,processor
B0894BLMLW,"Mini PC Windows 10 Pro Upgraded 8GB RAM 128GB SSD Intel Core i5-5257U Processor(up to 3.1Ghz), Desktop Computer 4K HD with USB-C/HDMI 2.0 / Mini DP Port,2X Ethernet Dual Wi-Fi",4.6,11,309.99,processor
B088BLZ1WK,"2020 Newest Dell Inspiron 15 3000 PC Laptop: 15.6"" HD Anti-Glare LED-Backlit Nontouch Display, Intel 2-Core 4205U Processor, 8GB RAM, 1TB HDD, WiFi, Bluetooth, HDMI, Webcam,DVD-RW, Win 10",4.1,652,514.0,processor
B00W2N5D1Y,Plantronics DA80 USB Audio Processor,4.4,107,58.9,processor
B08KH5T9LT,"ASUS Chromebook C523 15.6"" HD NanoEdge Display with 180 Degree Hinge Intel Dual Core Celeron N3350 Processor, 4GB RAM, 16GB eMMC, Silver Color, C523NA-DH46",4.3,1642,259.99,processor
B07JFH771Y,Intel Core i9-9940X X-Series Processor 14 Cores up to 4.4GHz Turbo Unlocked LGA2066 X299 Series 165W Processors (999AC9),4.5,62,775.0,processor
B07YWLS346,"2019 Dell Inspiron 3593 Laptop 15.6"", 10th Generation Intel Core i7-1065G7 Processor, 1TB HDD 16GB DDR4 RAM, HDMI, WiFi, Bluetooth, Windows 10, Black",4.3,31,809.99,processor
B0848TB4VX,"Newest 2020 HP 14"" Laptop 10th Gen Intel Core i3-1005G1 Processor 1.2GHz 4GB DDR4 2666 SDRAM 128GB SSD Windows 10",4.5,370,395.0,processor
B0754LGR2N,D-Link Wireless AC1750 WiFi Router – Smart Dual Band – MU-MIMO – Powerful Dual Core Processor – Blazing Fast Wi-Fi for Gaming and 4K Streaming – Reliable Coverage (DIR-867-US),4.2,391,199.99,processor
B08D72R6T4,"Lenovo 11.6inch Chromebook, Intel Celeron N4020 Dual-Core Processor, 4GB RAM, 32GB eMMC SSD, WiFi, Bluetooth, Chrome OS(Renewed)",4.5,226,201.0,processor
B08B45ZHQN,Blaupunkt EP1600X Car Audio Digital Bass Processor,4.3,20,37.95,processor
B08FD3QHQC,"Mini PC, Odyssey X86 Blue J4105 Windows 10 Desktop Computer, Intel Celeron Processor 8GB RAM and 128GB SSD with Re_Computer Case, Dual Gigabit Ethernet, Dual Band Wi-Fi/Bluetooth5.0, 4K HD,Dual Screen",4.6,13,269.0,processor
B088FHPFV8,"Aoxun Mini PC Windows10, Intel Core i3-5005U Processor 8GB/256GB M.2 SSD, Supports Extended RAM & SSD/4K@60Hz/Dual HDMI/Dual WiFi /BT4.0/ Fan",3.2,3,199.9,processor
B07QHZQG6G,"Lenovo ThinkPad T490 14.0"" FHD (1920x1080) 250 nits IPS Anti-Glare Display - Intel Core i5-8265U Processor, 16GB RAM, 512GB PCIe-NVMe SSD, Windows 10 Pro 64-bit",4.3,13,907.0,processor
B0842Z3FTR,"Newest HP 14inch Stream Laptop, AMD A4-9120 Processor, 4GB DDR4 RAM, 64GB SSD, AMD Radeon Graphics, WiFi, Bluetooth, HDMI, Win10 Home (Renewed) (Pink/A4/64GB)",4.5,42,320.0,processor
B089N6C6W2,"Lenovo IdeaCentre 3 Desktop, Tower, AMD Athlon Silver 3050U Processor, AMD Radeon Graphics, 4GB DDR4, 256GB SSD, Wi-Fi 802.11, Bluetooth, HDMI, 8 USB Ports, Windows 10, 90NT0000US, Silver",4.5,287,289.99,processor
B07TK5GBJ3,"Zoom B1 Four Electric Bass Effects Processor + Cables, 4 AA Batteries & Fibertique Microfiber Cleaning Cloth",4.5,2,94.99,processor
B088D72S78,"Pritom Kids Tablet, 32 GB ROM,Quad Core Processor, HD IPS Display,WiFi 7 inch Android Tablet,Tablet for Kids with Case",4.1,194,69.99,processor
B08K919Y91,"Beelink GK55 Mini PC Windows10 Pro(&ubuntu) Intel Celeron J4125 Processor 8GB RAM DDR4L/256GB SSD, 4K@60Hz, Dual Gigabit Ethernet, Dual Band WiFi, 4K HD, Dual HDMI, Mini Computer Support Auto Power On",4.4,21,259.0,processor
B07TBM1SVR,"Vankyo MatrixPad Z4 10 inch Tablet, Android 9.0 Pie, 2 GB RAM, 32 GB Storage, 8MP Rear Camera, Quad-Core Processor, 10.1 inch IPS HD Display, Wi-Fi, Black",3.9,4408,109.99,processor
B078H42W49,"Apple 13in MacBook Air, 1.8GHz Intel Core i5 Dual Core Processor, 8GB RAM, 128GB SSD, Mac OS, Silver, MQD32LL/A (Newest Version) (Renewed)",4.5,435,728.9,processor
B01EDFQ1ZK,AudioControl DQDX Black 6 Channel Performance Digital Signal Processor,4.3,28,299.99,processor
B07S1Q396F,Intel Core i5-9600 Desktop Processor 6 Cores up to 4.6 GHz LGA1151 300 Series 65W,4.2,6,233.42,processor
B07RQ846B9,"Jumper 11.6 inch Touchscreen Laptop 6GB RAM, 128GB eMMC 360 Degree Convertible Tablet PC Windows 10 Ultrabook PC Intel Celeron Quad core Processor Supports 256GB TF Card and 1TB SSD Extension",4.0,405,299.0,processor
B00O5VX6O2,"Thermaltake TG-7 Extreme Performance CPU GPU Heatsink Cooling Thermal Grease CL-O004-GROSGM-A, Gray",4.7,530,7.99,processor
B089FFGYC7,"Mini PC, ACEPC AK1 6GB RAM/120GB ROM Mini Computer Windows 10 Pro Intel Celeron Processor J3455 Desktop Computer Support 2.5"" SSD/mSATA SSD/4K HD/Dual HDMI/Gigabit Ethernet/Dual-Band",4.3,970,199.99,processor
B0895L9KYC,ASROCK B460M-ITX/AC Supports 10th Gen Intel Core Processors (Socket 1200) Motherboard,4.3,44,94.99,processor
B01N12D432,"Lenovo ThinkCentre Premium High Performance M91P Desktop Computer, Intel Core i5 Quad-Core Processor 3.1GHz, 8GB RAM, 1TB HDD, Windows 10 Home (Renewed)",3.9,892,148.0,processor
B07S1CD1NY,EXPERT 8 CH 15 Band EQ 3 PARAMATRIC EQ (PX8.2CONNECT),5.0,2,241.14,processor
B08H1T1SYP,"Asus TUF 15.6-inch FHD Gaming Laptop, AMD Quad Core Ryzen 5 3550H Processor, Nvidia Geforce GTX 1650 4GB Graphics, 8GB DDR4 RAM, 256GB Solid State Drive, RGB Backlit Keyboard, Windows 10 Home, Black",4.9,17,716.0,processor
B08HMVBXQ5,"Lenovo IdeaPad 3 15.6"" HD High Performance Laptop, Intel Core i5-1035G1 Quad-Core Processor, 8GB Memory, 256GB SSD, HDMI, Webcam, Wi-FI, Windows 10",4.3,5,539.0,processor
B07M8NBPXZ,Millennial Essentials Antistatic Resealable Bags ESD Shielding Bag for Hard Drive SSD HDD Motherboard Video Card RAM Electronic Devices (Pack of 60) (6” x 8”),4.8,355,12.95,processor
B0752FD3XJ,"ASUS AC2900 WiFi Dual-band Gigabit Wireless Router with 1.8GHz Dual-core Processor and AiProtection Network Security Powered by Trend Micro, AiMesh Whole Home WiFi System Compatible (RT-AC86U)",4.4,3222,169.01,processor
B087772M7L,"Acer Swift 3 Thin & Light Laptop, 14"" Full HD IPS, AMD Ryzen 5 4500U Hexa-Core Processor with Radeon Graphics, 8GB LPDDR4, 256GB NVMe SSD, WiFi 6, Backlit Keyboard, Fingerprint Reader, SF314-42-R7LH",4.5,72,629.99,processor
B08ML1HX5W,"Mini PC, Intel Celeron J3455 Processor(up to 2.3GHz) Windows 10(64-bit) Mini Desktop Computer with HDMI/VGA Port,4GB DDR3/64GB eMMC,Gigabit Ethernet,Dual Band Wi-Fi,Bluetooth 4.2,4K HD",4.2,55,156.99,processor
B07BQFMF8X,"HP 14 Inch Stream Laptop, Intel Celeron N3060 Processor, 4GB RAM, 32GB eMMC, HDMI (Renewed)",4.1,17,279.99,processor
B07KC6V4YF,Intel Core i9 i9-9900K Octa-core (8 Core) 3.60 GHz Processor - Socket H4 LGA-1151 - Retail Pack - 8 GT/s DMI - 64-bit Processing - 5 GHz Overclocking Speed - 14 nm - 3 Number of Monitors Supported - I,4.4,33,474.99,processor
B08LBZRVLG,"2020 Acer Chromebook 315 15.6"" Full HD 1080p IPS Touchscreen Laptop PC, Intel Celeron N4020 Dual-Core Processor, 4GB DDR4 RAM, 64GB eMMC, Webcam, WiFi, 12 Hrs Battery Life, Chrome OS, Platinum Gray",5.0,1,413.0,processor
B08DJCPL55,"ASUS Chromebook C202XA Rugged & Spill Resistant Laptop, 11.6"" HD, 180 Degree, MediaTek 8173C Processor, 4GB RAM, 32GB Storage, MIL-STD 810G Durability, Blue, Education, Chrome OS, C202XA-YB04-BL",4.6,27,386.8,processor
B08DHQMJ3H,Intel Cerleon G5905 Desktop Processor 2 Cores 3.5 GHz LGA1200 (Intel 400 Series chipset) 58W,5.0,1,54.95,processor
B089W2ZTHF,ASRock B550 PRO4 Supports 3rd Gen AMD AM4 Ryzen/Future AMD Ryzen Processors Motherboard,4.7,159,134.99,processor
B06XKWT7GD,AMD Ryzen 5 1600X Processor (YD160XBCAEWOF),4.8,1285,292.0,processor
B089VZFWHB,ASRock B550 Phantom Gaming 4 AC Supports 3rd Gen AMD AM4 Ryzen/Future AMD Ryzen Processors Motherboard,4.6,183,124.99,processor
B08P6MRZBG,"HP - Pavilion 15.6"" Gaming Laptop - AMD Ryzen 5 - 8GB Memory - NVIDIA GeForce GTX 1650 - 256GB SSD - Shadow Black",4.4,46,674.0,processor
B086MBQKH2,"Acer Chromebook Spin 311 Convertible Laptop, Intel Celeron N4020, 11.6"" HD Touch, 4GB LPDDR4, 32GB eMMC, Gigabit Wi-Fi 5, Bluetooth 5.0, Google Chrome, CP311-2H-C679",4.7,4117,305.0,processor
B0817HT7LM,"Laptop 2-in-1, Winnovo TaBook, Intel Pentium N4200 Quad Core Processor, 4GB RAM, 64GB Storage, Windows 10, Detachable Keyboard, Dual Band WiFi",4.1,14,369.99,processor
B087M2CQG6,"Jumper Laptop X3 Air, 13.3"" Full HD IPS Display, Intel Celeron N4100 Processor, 8GB DDR4 RAM 128GB SSD Thin and Light Computer, DTS Sound, 180°Rotation, Full Metal Body, Mocha Brown - 2021 Upgraded",4.5,46,369.99,processor
B082ZZQVSY,"Fanless Mini PC, Z83V Windows 10 64-bit (4GB DDR/64GB eMMC), Intel Quad-Core Atom x5-Z8350 Mini Desktop Computer, with HDMI/VGA Port, 2.4/5.8G WiFi,1000M LAN, BT4.0, Support Auto Power On",3.9,21,109.0,processor
B0009PTBZ6,Cooler Master High Performance Thermal Paste - (HTK-002-U1),4.6,3603,7.98,processor
B08MBH12TZ,"HP 2-in-1 Convertible Chromebook, 14inch HD Touchscreen, Intel Quad-Core Pentium Silver N5030 Processor Up to 3.10GHz, 4GB Ram, 128GB SSD, Intel UHD Graphics, Webcam, Chrome OS(Renewed (14inch/128GB)",4.4,21,339.99,processor
B081PT2DLY,"Acer 13.3inch IPS FHD Touchscreen 2-in-1 Chromebook, MediaTek Quad-core M8173C Processor 2.10GHz, 4GB LPDDR3 RAM, 64GB SSD, HDMI, Chrome OS(Renewed) (13.3""/MT8173C/64GB)",4.6,85,289.99,processor
B07YXWWMRL,"2019 Dell Inspiron 3593 Laptop 15.6"", 10th Generation Intel Core i5-1035G1 Processor, 8GB DDR4 RAM 256GB Solid State Drive, HDMI, WiFi, Bluetooth, Windows 10, Black",5.0,5,618.0,processor
B089SCHCJM,"HP 15.6inch Premium Flagship Laptop, AMD Dual-Core A9-9125 Processor Up to 2.6GHz, 4GB Ram, 500GB HDD, AMD Radeon R5 Graphics, WiFi, Bluetooth, HDMI, Win10 Home-Gold (Renewed)",4.1,902,409.99,processor
B07LC5WV9W,"MINISFORUM Windows 10 Pro Mini PC, Intel Atom Z8350 Quad-Core Processor,Mini PC Fanless 4GB DDR3 64GB eMMC, Expandable 128GB SD Card, Mini Desktop Computer Support 4K HD/Dual LAN/HDMI+VGA Port",4.0,77,129.99,processor
B084DXTG7M,"HP Stream 11-Inch Laptop, Intel X5-E8000 Processor, 4GB RAM, 32GB eMMC, Windows 10 Home in S Mode, Wifi, Bluetooth, HDMI(Renewed)",3.3,10,247.0,processor
B012UGC5D6,Plantronics 201851-01 DA70 USB Audio Processor,4.7,63,35.28,processor
B000P0ZX7K,"Soundstream BX-12 Digital Bass Processor,Black",4.4,99,59.29,processor
B07YW68K8F,"Mini PC, N34 Mini PC Windows 10(64-bit) 8GB DDR4 Ram 64GB eMMC Intel Celeron N3450 Quad-Core Processor(up to 2.2GHz) Fanless Mini Computer Micro PC, Dual 4K HDMI/Gigabit Ethernet/2.4G+5G WiFi, Linux",3.8,39,189.99,processor
B089K1BGBB,"Mini PC, Beelink U57 Intel Core i5-5257U Processor (up to 3.10GHz) Windows 10 Pro Mini Desktop Computer, 8GB DDR3L/128GB M.2 SSD, Supports Extended HDD & SSD 2.5″/4K HD/Dual HDMI/Dual WiFi /BT4.0",4.4,104,329.0,processor
B07VBK4SYS,"ASUS TUF FX505DT Gaming Laptop- 15.6"", 120Hz Full HD, AMD Ryzen 5 R5-3550H Processor, GeForce GTX 1650 Graphics, 8GB DDR4, 256GB PCIe SSD, RGB Keyboard, Windows 10 64-bit - FX505DT-AH51",4.5,2144,747.0,processor
B01BM27QI8,Novastar VX4S All-in-1 Controller / LED Video Processor with SDI,5.0,1,1299.0,processor
B089N4K38B,"Lenovo IdeaCentre AIO 3, 24"" All-in-One Computer, AMD Ryzen 3 4300U Mobile Processor, Integrated Graphics, 8GB DDR4, 256GB M.2 Name SSD, DVD RW Drive, Windows 10, F0EW005TUS, Business Black",4.7,355,549.99,processor
B088K23635,"2020 Dell Inspiron 3000 15.6-inch HD Touchscreen Laptop PC, Intel 10th Gen Dual Core i3-1005G1 Processor, 8GB DDR4, 128GB SSD, 1TB HDD, Bluetooth, Windows 10, Black",4.6,689,655.0,processor
B08RJ2WSDN,"Tablet 10.8 Inch Android 10.0, 4GB+64GB/ 512GB Extend 10-core 2.3Ghz Processor Tablets, 5G WiFi Dual 4G LTE 16MP Camera 2K FHD+ Tablet with Keyboard Case,8000mAh",4.4,45,209.99,processor
B089VTZ83Q,ASRock B550 Phantom Gaming 4 Supports 3rd Gen AMD AM4 Ryzen/Future AMD Ryzen Processors Motherboard,4.7,179,114.99,processor
